B1: Team | C1: Won | D1: Lost | E1: Ties | F1: % | G1: Points
A2: 1 | B2: Max Capital | C2: 9 | D2: 2 | F2: =C2/(C2+D2)*10 -> 8.1818181818181817 | G2: 18
A3: 2 | B3: Moonlight Grahams | C3: 6 | D3: 3 | F3: =C3/(C3+D3)*10 -> 6.6666666666666661 | G3: 12
A4: 3 | B4: Nomads | C4: 5 | D4: 3 | F4: =C4/(C4+D4)*10 -> 6.25 | G4: 10
A5: 4 | B5: Smith Barney | C5: 5 | D5: 3 | F5: =C5/(C5+D5)*10 -> 6.25 | G5: 10
A6: 5 | B6: High Rollers | C6: 6 | D6: 4 | F6: =C6/(C6+D6)*10 -> 6 | G6: 12
A7: 6 | B7: Grantchester | C7: 5 | D7: 4 | F7: =C7/(C7+D7)*10 -> 5.5555555555555554 | G7: 10
A8: 7 | B8: Falcons | C8: 5 | D8: 4 | F8: =C8/(C8+D8)*10 -> 5.5555555555555554 | G8: 10
A9: 8 | B9: Los Guapos | C9: 4 | D9: 5 | F9: =C9/(C9+D9)*10 -> 4.4444444444444446 | G9: 8
A10: 9 | B10: The Flushing Toilets | C10: 1 | D10: 5 | F10: =C10/(C10+D10)*10 -> 1.6666666666666665 | G10: 2
A11: 10 | B11: Axadents | C11: 0 | D11: 11 | F11: =C11/(C11+D11)*10 -> 0 | G11: 0