B1: Team | C1: Won | D1: Lost | E1: Ties | F1: % | G1: Points
A2: 1 | B2: The Lookouts | C2: 8 | D2: 1 | F2: =C2/(C2+D2)*10 -> 8.8888888888888893 | G2: 16
A3: 2 | B3: Daddee | C3: 7 | D3: 2 | F3: =C3/(C3+D3)*10 -> 7.7777777777777777 | G3: 14
A4: 3 | B4: Falcons | C4: 5 | D4: 2 | F4: =C4/(C4+D4)*10 -> 7.1428571428571432 | G4: 10
A5: 4 | B5: Nomads | C5: 5 | D5: 4 | F5: =C5/(C5+D5)*10 -> 5.5555555555555554 | G5: 10
A6: 5 | B6: Meister, Seelig | C6: 3 | D6: 3 | E6: 1 | F6: =C6/(C6+D6)*10 -> 5 | G6: 7
A7: 6 | B7: High Rollers | C7: 3 | D7: 4 | E7: 1 | F7: =C7/(C7+D7)*10 -> 4.2857142857142856 | G7: 7
A8: 7 | B8: Max Capital | C8: 3 | D8: 6 | F8: =C8/(C8+D8)*10 -> 3.333333333333333 | G8: 6
A9: 8 | B9: Moonlight Grahams | C9: 3 | D9: 6 | F9: =C9/(C9+D9)*10 -> 3.333333333333333 | G9: 6
A10: 9 | B10: Smith Barney | C10: 3 | D10: 7 | F10: =C10/(C10+D10)*10 -> 3 | G10: 6
A11: 10 | B11: Los Guapos | C11: 2 | D11: 7 | F11: =C11/(C11+D11)*10 -> 2.2222222222222223 | G11: 4

A1: Date | B1: Day | C1: Teams | D1: Scores
A2: 38110 | B2: Monday | C2: Max Capital | D2: r/o
C3: The Lookouts
C5: Falcons | D5: r/o
C6: Los Guapos
A8: 38111 | B8: Tuesday | C8: High Rollers | D8: 4
C9: Moonlight Grahams | D9: 5 | E9: *
C11: Nomads | D11: 7 | E11: *
C12: Smith Barney | D12: 6
C14: Meister, Seelig | D14: 2
C15: Daddees | D15: 3 | E15: *
A17: 38117 | B17: Monday | C17: Moonlight Grahams | D17: 6 | E17: *
C18: Nomads | D18: 5
C20: Smith Barney | D20: 17 | E20: *
C21: Meister, Seelig | D21: 5
A23: 38120 | B23: Thursday | C23: High Rollers | D23: 14 | E23: *
C24: Daddees | D24: 12
C26: Max Capital | D26: 3 | E26: *
C27: Falcons | D27: 2
A29: 38121 | B29: Friday | C29: The Lookouts | D29: 16 | E29: *
C30: Los Guapos | D30: 4
A32: 38124 | B32: Monday | C32: High Rollers | D32: 11 | E32: *
C33: Nomads | D33: 6
A35: 38127 | B35: Thursday | C35: Falcons | D35: reschedule
C36: Meister, Seelig
A38: 38128 | B38: Friday | C38: Max Capital | D38: 7 | E38: *
C39: Los Guapos | D39: 3
C41: The Lookouts | D41: 6 | E41: *
C42: Daddees | D42: 4
C44: Moonlight Grahams | D44: 15 | E44: *
C45: Smith Barney | D45: 14
A47: 38132 | B47: Tuesday | C47: Max Capital | D47: 7
C48: Daddees | D48: 8 | E48: *
C50: Los Guapos | D50: 5
C51: Nomads | D51: 8 | E51: *
A53: 38133 | B53: Wednesday | C53: The Lookouts | D53: 12 | E53: *
C54: Moonlight Grahams | D54: 0
C56: Falcons | D56: 8 | E56: *
C57: Smith Barney | D57: 1
C59: High Rollers | D59: 3 | E59: Tie
C60: Meister, Seelig | D60: 3
A62: 38139 | B62: Tuesday | C62: Max Capital | D62: rainout
C63: High Rollers
A65: 38140 | B65: Wednesday | C65: The Lookouts | D65: 7 | E65: *
C66: Nomads | D66: 4
A68: 38141 | B68: Thursday | C68: Max Capital | D68: 7 | E68: *
C69: Moonlight Grahams | D69: 0
A71: 38142 | B71: Friday | C71: Los Guapos | D71: 0
C72: Smith Barney | D72: 5 | E72: *
C74: Falcons | D74: 8
C75: Daddees | D75: 15 | E75: *
A77: 38146 | B77: Tuesday | C77: Max Capital | D77: 5
C78: Meister, Seelig | D78: 6 | E78: *
C80: Nomads | D80: 2
C81: Daddee | D81: 4 | E81: *
A83: 38147 | B83: Wednesday | C83: Falcons | D83: 13 | E83: *
C84: High Rollers | D84: 11
C86: The Lookouts | D86: 16 | E86: *
C87: Smith Barney | D87: 4
A89: 38148 | B89: Thursday | C89: Moonlight Grahams | D89: 4
C90: Meister, Seelig | D90: 5 | E90: *
A92: 38154 | B92: Wednesday | C92: Falcons | D92: 5 | E92: *
C93: Los Guapos | D93: 1
A95: 38156 | B95: Friday | C95: The Lookouts | D95: 15 | E95: *
C96: Moonlight Grahams | D96: 1
C98: Smith Barney | D98: 4
C99: Daddee | D99: 9 | E99: *
A101: 38161 | B101: Wednesday | C101: Smith Barney | D101: 2
C102: Daddee | D102: 3 | E102: *
A104: 38163 | B104: Friday | C104: The Lookouts | D104: r/o
C105: Falcons
A107: 38166 | B107: Monday | C107: Max Capital | D107: 5
C108: Meister, Seelig | D108: 7 | E108: *
A110: 38167 | B110: Tuesday | C110: The Lookouts | D110: 7 | E110: *
C111: Los Guapos | D111: 1
A113: 38174 | B113: Tuesday | C113: Moonlight Grahams | D113: 3
C114: Nomads | D114: 11 | E114: *
A116: 38177 | B116: Friday | C116: Max Capital | D116: 4
C117: Smith Barney | D117: 10 | E117: *
C119: The Lookouts | D119: 7 | E119: *
C120: High Rollers | D120: 0
A122: 38187 | B122: Monday | C122: Max Capital | D122: 0
C123: Los Guapos | D123: 7 | E123: *
C125: The Lookouts | D125: 0
C126: Falcons | D126: 1 | E126: *
A128: 38188 | B128: Tuesday | C128: High Rollers | D128: 9 | E128: *
C129: Moonlight Grahams | D129: 5
C131: Nomads | D131: 8 | E131: *
C132: Smith Barney | D132: 3
A134: 38189 | B134: Wednesday | C134: Meister, Seelig | D134: 1
C135: Daddee | D135: 5 | E135: *
A137: 38198 | B137: Friday | C137: Los Guapos | D137: 5
C138: Nomads | D138: 12 | E138: *
A140: 38204 | B140: Thursday | C140: Los Guapos | D140: 12 | E140: *
C141: High Rollers | D141: 7
A143: 38205 | B143: Friday | C143: Max Capital | D143: 0
C144: Falcons | D144: 6 | E144: *