O1: SLUG. | P1: ON BASE | Q1: BATTING
A2: NAME | B2: G | C2: APP | D2: AB | E2: R | F2: H | G2: 1B | H2: 2B | I2: 3B | J2: HR | K2: RBI | L2: BB | M2: K | N2: SAC | O2: PCT. | P2: PCT. | Q2: AVG.
A4: Casserly,Mike | B4: 4 | C4: 12 | D4: 12 | E4: 4 | F4: 8 | G4: 6 | H4: 1 | I4: 1 | J4: 0 | K4: 3 | L4: 0 | M4: 0 | N4: 0 | O4: =SUM(G4*1+H4*2+I4*3+J4*4)/D4 -> 0.91666666666666663 | P4: =SUM(F4+L4)/(D4+L4+N4) -> 0.66666666666666663 | Q4: =SUM(F4/D4) -> 0.66666666666666663
A5: Stanick,Keith | B5: 4 | C5: 14 | D5: 13 | E5: 4 | F5: 7 | G5: 4 | H5: 1 | I5: 0 | J5: 2 | K5: 4 | L5: 0 | M5: 0 | N5: 1 | O5: =SUM(G5*1+H5*2+I5*3+J5*4)/D5 -> 1.0769230769230769 | P5: =SUM(F5+L5)/(D5+L5+N5) -> 0.500 | Q5: =SUM(F5/D5) -> 0.53846153846153844
A6: Casserly,Pat | B6: 4 | C6: 14 | D6: 14 | E6: 6 | F6: 7 | G6: 4 | H6: 1 | I6: 1 | J6: 1 | K6: 4 | L6: 0 | M6: 0 | N6: 0 | O6: =SUM(G6*1+H6*2+I6*3+J6*4)/D6 -> 0.9285714285714286 | P6: =SUM(F6+L6)/(D6+L6+N6) -> 0.500 | Q6: =SUM(F6/D6) -> 0.500
A7: Mills,William | B7: 3 | C7: 8 | D7: 8 | E7: 2 | F7: 4 | G7: 3 | H7: 1 | I7: 0 | J7: 0 | K7: 3 | L7: 0 | M7: 0 | N7: 0 | O7: =SUM(G7*1+H7*2+I7*3+J7*4)/D7 -> 0.625 | P7: =SUM(F7+L7)/(D7+L7+N7) -> 0.500 | Q7: =SUM(F7/D7) -> 0.500
A8: Paper,Chris | B8: 4 | C8: 13 | D8: 12 | E8: 4 | F8: 6 | G8: 6 | H8: 0 | I8: 0 | J8: 0 | K8: 1 | L8: 0 | M8: 0 | N8: 1 | O8: =SUM(G8*1+H8*2+I8*3+J8*4)/D8 -> 0.500 | P8: =SUM(F8+L8)/(D8+L8+N8) -> 0.46153846153846156 | Q8: =SUM(F8/D8) -> 0.500
A9: Rivera,Greg | B9: 2 | C9: 7 | D9: 6 | E9: 1 | F9: 3 | G9: 3 | H9: 0 | I9: 0 | J9: 0 | K9: 4 | L9: 0 | M9: 0 | N9: 0 | O9: =SUM(G9*1+H9*2+I9*3+J9*4)/D9 -> 0.500 | P9: =SUM(F9+L9)/(D9+L9+N9) -> 0.500 | Q9: =SUM(F9/D9) -> 0.500
A10: Chin,Vernon | B10: 3 | C10: 7 | D10: 7 | E10: 2 | F10: 3 | G10: 3 | H10: 0 | I10: 0 | J10: 0 | K10: 3 | L10: 1 | M10: 0 | N10: 0 | O10: =SUM(G10*1+H10*2+I10*3+J10*4)/D10 -> 0.42857142857142855 | P10: =SUM(F10+L10)/(D10+L10+N10) -> 0.500 | Q10: =SUM(F10/D10) -> 0.42857142857142855
A11: Bloom,Adam | B11: 2 | C11: 8 | D11: 8 | E11: 2 | F11: 3 | G11: 1 | H11: 1 | I11: 1 | J11: 0 | K11: 1 | L11: 0 | M11: 0 | N11: 0 | O11: =SUM(G11*1+H11*2+I11*3+J11*4)/D11 -> 0.750 | P11: =SUM(F11+L11)/(D11+L11+N11) -> 0.375 | Q11: =SUM(F11/D11) -> 0.375
A12: Rupe,Bob | B12: 4 | C12: 15 | D12: 15 | E12: 2 | F12: 5 | G12: 4 | H12: 0 | I12: 0 | J12: 1 | K12: 1 | L12: 0 | M12: 0 | N12: 0 | O12: =SUM(G12*1+H12*2+I12*3+J12*4)/D12 -> 0.53333333333333333 | P12: =SUM(F12+L12)/(D12+L12+N12) -> 0.33333333333333331 | Q12: =SUM(F12/D12) -> 0.33333333333333331
A13: Kull,Christian | B13: 1 | C13: 3 | D13: 3 | E13: 0 | F13: 1 | G13: 1 | H13: 0 | I13: 0 | J13: 0 | K13: 0 | L13: 0 | M13: 0 | N13: 0 | O13: =SUM(G13*1+H13*2+I13*3+J13*4)/D13 -> 0.33333333333333331 | P13: =SUM(F13+L13)/(D13+L13+N13) -> 0.33333333333333331 | Q13: =SUM(F13/D13) -> 0.33333333333333331
A14: Kostulias,Bob | B14: 4 | C14: 12 | D14: 9 | E14: 2 | F14: 3 | G14: 3 | H14: 0 | I14: 0 | J14: 0 | K14: 0 | L14: 3 | M14: 0 | N14: 0 | O14: =SUM(G14*1+H14*2+I14*3+J14*4)/D14 -> 0.33333333333333331 | P14: =SUM(F14+L14)/(D14+L14+N14) -> 0.500 | Q14: =SUM(F14/D14) -> 0.33333333333333331
A15: Sandurs,Eric | B15: 4 | C15: 13 | D15: 10 | E15: 4 | F15: 3 | G15: 2 | H15: 1 | I15: 0 | J15: 0 | K15: 0 | L15: 3 | M15: 0 | N15: 0 | O15: =SUM(G15*1+H15*2+I15*3+J15*4)/D15 -> 00.4 | P15: =SUM(F15+L15)/(D15+L15+N15) -> 0.46153846153846156 | Q15: =SUM(F15/D15) -> 00.3
A16: Cruz,Orlando | B16: 3 | C16: 9 | D16: 8 | E16: 3 | F16: 2 | G16: 0 | H16: 1 | I16: 0 | J16: 1 | K16: 2 | L16: 1 | M16: 0 | N16: 0 | O16: =SUM(G16*1+H16*2+I16*3+J16*4)/D16 -> 0.750 | P16: =SUM(F16+L16)/(D16+L16+N16) -> 0.33333333333333331 | Q16: =SUM(F16/D16) -> 0.250
A17: Eurele,Dan | B17: 3 | C17: 9 | D17: 8 | E17: 2 | F17: 2 | G17: 1 | H17: 0 | I17: 0 | J17: 1 | K17: 3 | L17: 0 | M17: 0 | N17: 1 | O17: =SUM(G17*1+H17*2+I17*3+J17*4)/D17 -> 0.625 | P17: =SUM(F17+L17)/(D17+L17+N17) -> 0.22222222222222221 | Q17: =SUM(F17/D17) -> 0.250
A18: Follo,Shaun | B18: 1 | C18: 4 | D18: 4 | E18: 0 | F18: 1 | G18: 1 | H18: 0 | I18: 0 | J18: 0 | K18: 0 | L18: 0 | M18: 0 | N18: 0 | O18: =SUM(G18*1+H18*2+I18*3+J18*4)/D18 -> 0.250 | P18: =SUM(F18+L18)/(D18+L18+N18) -> 0.250 | Q18: =SUM(F18/D18) -> 0.250
A20: TOTALS | B20: 4 | C20: =SUM(C1:C18) -> 148 | D20: =SUM(D1:D18) -> 137 | E20: =SUM(E1:E18) -> 38 | F20: =SUM(F1:F18) -> 58 | G20: =SUM(G1:G18) -> 42 | H20: =SUM(H1:H18) -> 7 | I20: =SUM(I1:I18) -> 3 | J20: =SUM(J1:J18) -> 6 | K20: =SUM(K1:K18) -> 29 | L20: =SUM(L1:L18) -> 8 | M20: =SUM(M1:M18) -> 0 | N20: =SUM(N1:N18) -> 3 | O20: =SUM(G20*1+H20*2+I20*3+J20*4)/D20 -> 0.64963503649635035 | P20: =SUM(F20+L20)/(D20+L20+N20) -> 0.44594594594594594 | Q20: =SUM(F20/D20) -> 0.42335766423357662

E1: FIELDING | F1: POSITION(S)
A2: NAME | B2: PO | C2: A | D2: E | E2: PCT. | F2: PLAYED
A4: Bloom,Adam | B4: 5 | C4: 0 | D4: 0 | E4: =SUM(B4+C4)/(B4+C4+D4) -> 1.000 | F4: OF
A5: Casserly,Pat | B5: 10 | C5: 1 | D5: 0 | E5: =SUM(B5+C5)/(B5+C5+D5) -> 1.000 | F5: OF
A6: Chin,Vernon | B6: 1 | C6: 0 | D6: 0 | E6: =SUM(B6+C6)/(B6+C6+D6) -> 1.000 | F6: C
A7: Follo,Shaun | B7: 2 | C7: 0 | D7: 0 | E7: =SUM(B7+C7)/(B7+C7+D7) -> 1.000 | F7: OF
A8: Kostulias,Bob | B8: 3 | C8: 10 | D8: 0 | E8: =SUM(B8+C8)/(B8+C8+D8) -> 1.000 | F8: P
A9: Kull,Christian | B9: 1 | C9: 2 | D9: 0 | E9: =SUM(B9+C9)/(B9+C9+D9) -> 1.000 | F9: 2B
A10: Paper,Chris | B10: 5 | C10: 1 | D10: 0 | E10: =SUM(B10+C10)/(B10+C10+D10) -> 1.000 | F10: OF
A11: Rivera,Greg | B11: 2 | C11: 0 | D11: 0 | E11: =SUM(B11+C11)/(B11+C11+D11) -> 1.000 | F11: OF
A12: Rupe,Bob | B12: 22 | C12: 0 | D12: 0 | E12: =SUM(B12+C12)/(B12+C12+D12) -> 1.000 | F12: OF
A13: Stanick,Keith | B13: 2 | C13: 0 | D13: 0 | E13: =SUM(B13+C13)/(B13+C13+D13) -> 1.000 | F13: OF
A14: Cruz,Orlando | B14: 9 | C14: 5 | D14: 1 | E14: =SUM(B14+C14)/(B14+C14+D14) -> 0.93333333333333335 | F14: 2B
A15: Eurele,Dan | B15: 6 | C15: 5 | D15: 1 | E15: =SUM(B15+C15)/(B15+C15+D15) -> 0.91666666666666663 | F15: 3B
A16: Casserly,Mike | B16: 10 | C16: 13 | D16: 3 | E16: =SUM(B16+C16)/(B16+C16+D16) -> 0.88461538461538458 | F16: SS
A17: Sandurs,Eric | B17: 6 | C17: 1 | D17: 1 | E17: =SUM(B17+C17)/(B17+C17+D17) -> 0.875 | F17: OF
A18: Mills,William | B18: 0 | C18: 1 | D18: 1 | E18: =SUM(B18+C18)/(B18+C18+D18) -> 0.500 | F18: C
A20: TOTALS | B20: =SUM(B4:B19) -> 84 | C20: =SUM(C4:C19) -> 39 | D20: =SUM(D4:D19) -> 7 | E20: =SUM(B20+C20)/(B20+C20+D20) -> 0.94615384615384612

M1: OPP.
A2: NAME | B2: G | C2: IP | D2: R | E2: H | F2: ER | G2: BB | H2: SO | I2: W | J2: L | K2: .PCT | L2: ERA | M2: B.AVG.
A4: Bob Kostulias | B4: 4 | C4: 28.00 | D4: 13 | E4: 38 | F4: 10 | G4: 4 | H4: 5 | I4: 4 | J4: 0 | K4: =SUM(I4/B4) -> 1.000 | L4: =SUM(F4/C4*7) -> 2.50 | M4: =SUM(E4/(C4*3+E4)) -> 0.31147540983606559
A6: TOTALS | B6: =SUM(B4:B5) -> 4 | C6: 28.00 | D6: =SUM(D4:D5) -> 13 | E6: =SUM(E4:E5) -> 38 | F6: =SUM(F4:F5) -> 10 | G6: =SUM(G4:G5) -> 4 | H6: =SUM(H4:H5) -> 5 | I6: =SUM(I4:I5) -> 4 | J6: =SUM(J4:J5) -> 0 | K6: =SUM(I6/B6) -> 1.000 | L6: =SUM(F6/C6*7) -> 2.50 | M6: =SUM(E6/(C6*3+E6)) -> 0.31147540983606559

B2: Click here for 2002 Regular Season Stats