O1: SLUG. | P1: ON BASE | Q1: BATTING
A2: NAME | B2: G | C2: APP | D2: AB | E2: R | F2: H | G2: 1B | H2: 2B | I2: 3B | J2: HR | K2: RBI | L2: BB | M2: K | N2: SAC | O2: PCT. | P2: PCT. | Q2: AVG.
A4: Gazso,Paul | B4: 1 | C4: 1 | D4: 1 | E4: 1 | F4: 1 | G4: 1 | H4: 0 | I4: 0 | J4: 0 | K4: 1 | L4: 0 | M4: 0 | N4: 0 | O4: =SUM(G4*1+H4*2+I4*3+J4*4)/D4 -> 1.000 | P4: =SUM(F4+L4)/(D4+L4+N4) -> 1.000 | Q4: =SUM(F4/D4) -> 1.000
A5: Bloom,Ron | B5: 1 | C5: 4 | D5: 3 | E5: 0 | F5: 2 | G5: 2 | H5: 0 | I5: 0 | J5: 0 | K5: 1 | L5: 1 | M5: 0 | N5: 0 | O5: =SUM(G5*1+H5*2+I5*3+J5*4)/D5 -> 0.66666666666666663 | P5: =SUM(F5+L5)/(D5+L5+N5) -> 0.750 | Q5: =SUM(F5/D5) -> 0.66666666666666663
A6: Coen,Mike | B6: 9 | C6: 32 | D6: 31 | E6: 9 | F6: 17 | G6: 11 | H6: 3 | I6: 3 | J6: 0 | K6: 11 | L6: 0 | M6: 0 | N6: 1 | O6: =SUM(G6*1+H6*2+I6*3+J6*4)/D6 -> 0.83870967741935487 | P6: =SUM(F6+L6)/(D6+L6+N6) -> 0.53125 | Q6: =SUM(F6/D6) -> 0.54838709677419351
A7: Sandurs,Eric | B7: 9 | C7: 31 | D7: 29 | E7: 12 | F7: 15 | G7: 12 | H7: 3 | I7: 0 | J7: 0 | K7: 7 | L7: 2 | M7: 0 | N7: 0 | O7: =SUM(G7*1+H7*2+I7*3+J7*4)/D7 -> 0.62068965517241381 | P7: =SUM(F7+L7)/(D7+L7+N7) -> 0.54838709677419351 | Q7: =SUM(F7/D7) -> 0.51724137931034486
A8: Casserly,Mike | B8: 10 | C8: 28 | D8: 28 | E8: 7 | F8: 14 | G8: 9 | H8: 4 | I8: 1 | J8: 0 | K8: 6 | L8: 0 | M8: 0 | N8: 0 | O8: =SUM(G8*1+H8*2+I8*3+J8*4)/D8 -> 0.7142857142857143 | P8: =SUM(F8+L8)/(D8+L8+N8) -> 0.500 | Q8: =SUM(F8/D8) -> 0.500
A9: Kostulias,Bob | B9: 12 | C9: 35 | D9: 28 | E9: 6 | F9: 14 | G9: 11 | H9: 3 | I9: 0 | J9: 0 | K9: 4 | L9: 7 | M9: 0 | N9: 0 | O9: =SUM(G9*1+H9*2+I9*3+J9*4)/D9 -> 0.6071428571428571 | P9: =SUM(F9+L9)/(D9+L9+N9) -> 00.6 | Q9: =SUM(F9/D9) -> 0.500
A10: Kull,Christian | B10: 1 | C10: 2 | D10: 2 | E10: 0 | F10: 1 | G10: 1 | H10: 0 | I10: 0 | J10: 0 | K10: 0 | L10: 0 | M10: 0 | N10: 0 | O10: =SUM(G10*1+H10*2+I10*3+J10*4)/D10 -> 0.500 | P10: =SUM(F10+L10)/(D10+L10+N10) -> 0.500 | Q10: =SUM(F10/D10) -> 0.500
A11: McGuigan,Mike | B11: 1 | C11: 5 | D11: 4 | E11: 0 | F11: 2 | G11: 2 | H11: 0 | I11: 0 | J11: 0 | K11: 0 | L11: 1 | M11: 0 | N11: 0 | O11: =SUM(G11*1+H11*2+I11*3+J11*4)/D11 -> 0.500 | P11: =SUM(F11+L11)/(D11+L11+N11) -> 00.6 | Q11: =SUM(F11/D11) -> 0.500
A12: Stanick,Keith | B12: 12 | C12: 36 | D12: 34 | E12: 12 | F12: 17 | G12: 9 | H12: 2 | I12: 2 | J12: 4 | K12: 13 | L12: 1 | M12: 0 | N12: 1 | O12: =SUM(G12*1+H12*2+I12*3+J12*4)/D12 -> 1.0294117647058822 | P12: =SUM(F12+L12)/(D12+L12+N12) -> 0.500 | Q12: =SUM(F12/D12) -> 0.500
A13: Euerle,Dan | B13: 9 | C13: 25 | D13: 22 | E13: 8 | F13: 10 | G13: 6 | H13: 3 | I13: 0 | J13: 1 | K13: 8 | L13: 2 | M13: 1 | N13: 1 | O13: =SUM(G13*1+H13*2+I13*3+J13*4)/D13 -> 0.72727272727272729 | P13: =SUM(F13+L13)/(D13+L13+N13) -> 00.48 | Q13: =SUM(F13/D13) -> 0.45454545454545453
A14: Paper,Chris | B14: 8 | C14: 26 | D14: 23 | E14: 8 | F14: 10 | G14: 7 | H14: 0 | I14: 3 | J14: 0 | K14: 7 | L14: 2 | M14: 0 | N14: 1 | O14: =SUM(G14*1+H14*2+I14*3+J14*4)/D14 -> 0.69565217391304346 | P14: =SUM(F14+L14)/(D14+L14+N14) -> 0.46153846153846156 | Q14: =SUM(F14/D14) -> 0.43478260869565216
A15: Rivera,Greg | B15: 9 | C15: 30 | D15: 30 | E15: 9 | F15: 13 | G15: 10 | H15: 3 | I15: 0 | J15: 0 | K15: 2 | L15: 0 | M15: 1 | N15: 0 | O15: =SUM(G15*1+H15*2+I15*3+J15*4)/D15 -> 0.53333333333333333 | P15: =SUM(F15+L15)/(D15+L15+N15) -> 0.43333333333333335 | Q15: =SUM(F15/D15) -> 0.43333333333333335
A16: Rupe,Bob | B16: 11 | C16: 37 | D16: 31 | E16: 12 | F16: 13 | G16: 10 | H16: 1 | I16: 2 | J16: 0 | K16: 6 | L16: 3 | M16: 1 | N16: 3 | O16: =SUM(G16*1+H16*2+I16*3+J16*4)/D16 -> 0.58064516129032262 | P16: =SUM(F16+L16)/(D16+L16+N16) -> 0.43243243243243246 | Q16: =SUM(F16/D16) -> 0.41935483870967744
A17: Chin,Vernon | B17: 9 | C17: 27 | D17: 24 | E17: 4 | F17: 10 | G17: 10 | H17: 0 | I17: 0 | J17: 0 | K17: 3 | L17: 3 | M17: 1 | N17: 0 | O17: =SUM(G17*1+H17*2+I17*3+J17*4)/D17 -> 0.41666666666666669 | P17: =SUM(F17+L17)/(D17+L17+N17) -> 0.48148148148148145 | Q17: =SUM(F17/D17) -> 0.41666666666666669
A18: Bloom,Adam | B18: 8 | C18: 28 | D18: 27 | E18: 8 | F18: 11 | G18: 5 | H18: 3 | I18: 1 | J18: 2 | K18: 6 | L18: 1 | M18: 0 | N18: 0 | O18: =SUM(G18*1+H18*2+I18*3+J18*4)/D18 -> 0.81481481481481477 | P18: =SUM(F18+L18)/(D18+L18+N18) -> 0.42857142857142855 | Q18: =SUM(F18/D18) -> 0.40740740740740738
A19: Boggiano,Cass | B19: 1 | C19: 3 | D19: 3 | E19: 0 | F19: 1 | G19: 1 | H19: 0 | I19: 0 | J19: 0 | K19: 0 | L19: 0 | M19: 0 | N19: 0 | O19: =SUM(G19*1+H19*2+I19*3+J19*4)/D19 -> 0.33333333333333331 | P19: =SUM(F19+L19)/(D19+L19+N19) -> 0.33333333333333331 | Q19: =SUM(F19/D19) -> 0.33333333333333331
A20: Hanson,Steve | B20: 1 | C20: 3 | D20: 3 | E20: 0 | F20: 1 | G20: 1 | H20: 0 | I20: 0 | J20: 0 | K20: 0 | L20: 0 | M20: 0 | N20: 0 | O20: =SUM(G20*1+H20*2+I20*3+J20*4)/D20 -> 0.33333333333333331 | P20: =SUM(F20+L20)/(D20+L20+N20) -> 0.33333333333333331 | Q20: =SUM(F20/D20) -> 0.33333333333333331
A21: Mills,William | B21: 4 | C21: 13 | D21: 12 | E21: 1 | F21: 4 | G21: 4 | H21: 0 | I21: 0 | J21: 0 | K21: 2 | L21: 0 | M21: 0 | N21: 1 | O21: =SUM(G21*1+H21*2+I21*3+J21*4)/D21 -> 0.33333333333333331 | P21: =SUM(F21+L21)/(D21+L21+N21) -> 0.30769230769230771 | Q21: =SUM(F21/D21) -> 0.33333333333333331
A22: Casserly,Pat | B22: 5 | C22: 17 | D22: 17 | E22: 3 | F22: 5 | G22: 4 | H22: 1 | I22: 0 | J22: 0 | K22: 0 | L22: 0 | M22: 0 | N22: 0 | O22: =SUM(G22*1+H22*2+I22*3+J22*4)/D22 -> 0.35294117647058826 | P22: =SUM(F22+L22)/(D22+L22+N22) -> 0.29411764705882354 | Q22: =SUM(F22/D22) -> 0.29411764705882354
A23: Follo,Shaun | B23: 1 | C23: 4 | D23: 4 | E23: 1 | F23: 1 | G23: 1 | H23: 0 | I23: 0 | J23: 0 | K23: 0 | L23: 0 | M23: 0 | N23: 0 | O23: =SUM(G23*1+H23*2+I23*3+J23*4)/D23 -> 0.250 | P23: =SUM(F23+L23)/(D23+L23+N23) -> 0.250 | Q23: =SUM(F23/D23) -> 0.250
A24: Pagliaro,John | B24: 3 | C24: 7 | D24: 6 | E24: 3 | F24: 1 | G24: 1 | H24: 0 | I24: 0 | J24: 0 | K24: 1 | L24: 1 | M24: 0 | N24: 0 | O24: =SUM(G24*1+H24*2+I24*3+J24*4)/D24 -> 0.16666666666666666 | P24: =SUM(F24+L24)/(D24+L24+N24) -> 0.2857142857142857 | Q24: =SUM(F24/D24) -> 0.16666666666666666
A25: Gray,Todd | B25: 1 | C25: 5 | D25: 5 | E25: 0 | F25: 0 | G25: 0 | H25: 0 | I25: 0 | J25: 0 | K25: 0 | L25: 0 | M25: 0 | N25: 0 | O25: =SUM(G25*1+H25*2+I25*3+J25*4)/D25 -> 0.000 | P25: =SUM(F25+L25)/(D25+L25+N25) -> 0.000 | Q25: =SUM(F25/D25) -> 0.000
A26: Leonard,John | B26: 4 | C26: 10 | D26: 10 | E26: 0 | F26: 0 | G26: 0 | H26: 0 | I26: 0 | J26: 0 | K26: 0 | L26: 0 | M26: 0 | N26: 0 | O26: =SUM(G26*1+H26*2+I26*3+J26*4)/D26 -> 0.000 | P26: =SUM(F26+L26)/(D26+L26+N26) -> 0.000 | Q26: =SUM(F26/D26) -> 0.000
A27: Steinmann,Gina | B27: 2 | C27: 5 | D27: 5 | E27: 0 | F27: 0 | G27: 0 | H27: 0 | I27: 0 | J27: 0 | K27: 0 | L27: 0 | M27: 0 | N27: 0 | O27: =SUM(G27*1+H27*2+I27*3+J27*4)/D27 -> 0.000 | P27: =SUM(F27+L27)/(D27+L27+N27) -> 0.000 | Q27: =SUM(F27/D27) -> 0.000
A29: TOTALS | B29: 12 | C29: =SUM(C4:C27) -> 414 | D29: =SUM(D4:D27) -> 382 | E29: =SUM(E4:E27) -> 104 | F29: =SUM(F4:F27) -> 163 | G29: =SUM(G4:G27) -> 118 | H29: =SUM(H4:H27) -> 26 | I29: =SUM(I4:I27) -> 12 | J29: =SUM(J4:J27) -> 7 | K29: =SUM(K4:K27) -> 78 | L29: =SUM(L4:L27) -> 24 | M29: =SUM(M4:M27) -> 4 | N29: =SUM(N4:N27) -> 8 | O29: =SUM(G29*1+H29*2+I29*3+J29*4)/D29 -> 0.61256544502617805 | P29: =SUM(F29+L29)/(D29+L29+N29) -> 0.45169082125603865 | Q29: =SUM(F29/D29) -> 0.42670157068062825

E1: FIELDING | F1: POSITION(S)
A2: NAME | B2: PO | C2: A | D2: E | E2: PCT. | F2: PLAYED
A4: Boggiano,Cass | B4: 1 | C4: 2 | D4: 0 | E4: =SUM(B4+C4)/(B4+C4+D4) -> 1.000 | F4: 2B,OF
A5: Chin, Vernon | B5: 4 | C5: 1 | D5: 0 | E5: =SUM(B5+C5)/(B5+C5+D5) -> 1.000 | F5: C,DH,EH
A6: Follo,Shaun | B6: 1 | C6: 0 | D6: 0 | E6: =SUM(B6+C6)/(B6+C6+D6) -> 1.000 | F6: OF,2B
A7: Gray,Todd | B7: 2 | C7: 0 | D7: 0 | E7: =SUM(B7+C7)/(B7+C7+D7) -> 1.000 | F7: OF
A8: Kostulias,Bob | B8: 3 | C8: 23 | D8: 0 | E8: =SUM(B8+C8)/(B8+C8+D8) -> 1.000 | F8: P
A9: Kull,Christian | B9: 3 | C9: 1 | D9: 0 | E9: =SUM(B9+C9)/(B9+C9+D9) -> 1.000 | F9: 3B
A10: Pagliaro,John | B10: 5 | C10: 2 | D10: 0 | E10: =SUM(B10+C10)/(B10+C10+D10) -> 1.000 | F10: 2B,3B,C
A11: Rivera,Greg | B11: 27 | C11: 0 | D11: 0 | E11: =SUM(B11+C11)/(B11+C11+D11) -> 1.000 | F11: OF
A12: Bloom,Adam | B12: 20 | C12: 12 | D12: 1 | E12: =SUM(B12+C12)/(B12+C12+D12) -> 0.96969696969696972 | F12: OF,2B
A13: Eurele,Dan | B13: 17 | C13: 23 | D13: 2 | E13: =SUM(B13+C13)/(B13+C13+D13) -> 0.95238095238095233 | F13: 3B,SS
A14: Rupe,Bob | B14: 39 | C14: 0 | D14: 2 | E14: =SUM(B14+C14)/(B14+C14+D14) -> 0.95121951219512191 | F14: OF,C,1B
A15: Casserly,Pat | B15: 14 | C15: 1 | D15: 1 | E15: =SUM(B15+C15)/(B15+C15+D15) -> 0.9375 | F15: OF
A16: Casserly,Mike | B16: 22 | C16: 33 | D16: 5 | E16: =SUM(B16+C16)/(B16+C16+D16) -> 0.91666666666666663 | F16: SS
A17: Paper,Chris | B17: 18 | C17: 3 | D17: 2 | E17: =SUM(B17+C17)/(B17+C17+D17) -> 0.91304347826086951 | F17: 1B,3B,C,
A18: Coen,Mike | B18: 15 | C18: 5 | D18: 2 | E18: =SUM(B18+C18)/(B18+C18+D18) -> 0.90909090909090906 | F18: 1B,2B,OF,C,DH
A19: Stancik,Keith | B19: 9 | C19: 0 | D19: 1 | E19: =SUM(B19+C19)/(B19+C19+D19) -> 00.9 | F19: OF,C
A20: Bloom,Ron | B20: 8 | C20: 0 | D20: 1 | E20: =SUM(B20+C20)/(B20+C20+D20) -> 0.88888888888888884 | F20: 1B
A21: McGuigan,Mike | B21: 5 | C21: 2 | D21: 1 | E21: =SUM(B21+C21)/(B21+C21+D21) -> 0.875 | F21: 2B
A22: Sandurs,Eric | B22: 18 | C22: 3 | D22: 7 | E22: =SUM(B22+C22)/(B22+C22+D22) -> 0.750 | F22: OF
A23: Hanson,Steve | B23: 2 | C23: 0 | D23: 1 | E23: =SUM(B23+C23)/(B23+C23+D23) -> 0.66666666666666663 | F23: OF
A24: Leonard,John | B24: 2 | C24: 0 | D24: 1 | E24: =SUM(B24+C24)/(B24+C24+D24) -> 0.66666666666666663 | F24: 1B,OF,DH
A25: Mills,William | B25: 2 | C25: 0 | D25: 1 | E25: =SUM(B25+C25)/(B25+C25+D25) -> 0.66666666666666663 | F25: 3B,C
A26: Gazso,Paul | B26: 0 | C26: 0 | D26: 0 | E26: 0.000 | F26: OF
A28: TOTALS | B28: =SUM(B4:B27) -> 237 | C28: =SUM(C4:C27) -> 111 | D28: =SUM(D4:D27) -> 28 | E28: =SUM(B28+C28)/(B28+C28+D28) -> 0.92553191489361697

M1: OPP.
A2: NAME | B2: G | C2: IP | D2: R | E2: H | F2: ER | G2: BB | H2: SO | I2: W | J2: L | K2: .PCT | L2: ERA | M2: B.AVG.
A4: Bob Kostulias | B4: 12 | C4: 80.00 | D4: 70 | E4: 142 | F4: 58 | G4: 1 | H4: 7 | I4: 8 | J4: 4 | K4: =SUM(I4/B4) -> 0.66666666666666663 | L4: =SUM(F4/C4*7) -> 5.0750000000000002 | M4: =SUM(E4/(C4*3+E4)) -> 0.37172774869109948
A6: TOTALS | B6: =SUM(B4:B5) -> 12 | C6: 80.00 | D6: =SUM(D4:D5) -> 70 | E6: =SUM(E4:E5) -> 142 | F6: =SUM(F4:F5) -> 58 | G6: =SUM(G4:G5) -> 1 | H6: =SUM(H4:H5) -> 7 | I6: =SUM(I4:I5) -> 8 | J6: =SUM(J4:J5) -> 4 | K6: =SUM(I6/B6) -> 0.66666666666666663 | L6: =SUM(F6/C6*7) -> 5.0750000000000002 | M6: =SUM(E6/(C6*3+E6)) -> 0.37172774869109948

B2: Click here for 2002 Post-Season Stats