O1: SLUG. | P1: ON BASE | Q1: BATTING
A2: NAME | B2: G | C2: APP | D2: AB | E2: R | F2: H | G2: 1B | H2: 2B | I2: 3B | J2: HR | K2: RBI | L2: BB | M2: K | N2: SAC | O2: PCT. | P2: PCT. | Q2: AVG.
A4: Miller,Scott | B4: 2 | C4: 4 | D4: 4 | E4: 2 | F4: 3 | G4: 3 | H4: 0 | I4: 0 | J4: 0 | K4: 1 | L4: 0 | M4: 0 | N4: 0 | O4: =SUM(G4*1+H4*2+I4*3+J4*4)/D4 -> 0.750 | P4: =SUM(F4+L4)/(D4+L4+N4) -> 0.750 | Q4: =SUM(F4/D4) -> 0.750
A5: Scheid,Aaron | B5: 3 | C5: 11 | D5: 10 | E5: 5 | F5: 6 | G5: 3 | H5: 1 | I5: 1 | J5: 1 | K5: 5 | L5: 1 | M5: 0 | N5: 0 | O5: =SUM(G5*1+H5*2+I5*3+J5*4)/D5 -> 1.200 | P5: =SUM(F5+L5)/(D5+L5+N5) -> 0.63636363636363635 | Q5: =SUM(F5/D5) -> 00.6
A6: Chin,Vernon | B6: 3 | C6: 9 | D6: 7 | E6: 0 | F6: 4 | G6: 4 | H6: 0 | I6: 0 | J6: 0 | K6: 2 | L6: 1 | M6: 0 | N6: 1 | O6: =SUM(G6*1+H6*2+I6*3+J6*4)/D6 -> 0.5714285714285714 | P6: =SUM(F6+L6)/(D6+L6+N6) -> 0.55555555555555558 | Q6: =SUM(F6/D6) -> 0.5714285714285714
A7: Casserly,Mike | B7: 3 | C7: 8 | D7: 8 | E7: 2 | F7: 4 | G7: 2 | H7: 0 | I7: 1 | J7: 1 | K7: 4 | L7: 0 | M7: 0 | N7: 0 | O7: =SUM(G7*1+H7*2+I7*3+J7*4)/D7 -> 1.125 | P7: =SUM(F7+L7)/(D7+L7+N7) -> 0.500 | Q7: =SUM(F7/D7) -> 0.500
A8: Casserly,Pat | B8: 2 | C8: 7 | D8: 7 | E8: 2 | F8: 3 | G8: 3 | H8: 0 | I8: 0 | J8: 0 | K8: 0 | L8: 0 | M8: 0 | N8: 0 | O8: =SUM(G8*1+H8*2+I8*3+J8*4)/D8 -> 0.42857142857142855 | P8: =SUM(F8+L8)/(D8+L8+N8) -> 0.42857142857142855 | Q8: =SUM(F8/D8) -> 0.42857142857142855
A9: Stanick,Keith | B9: 3 | C9: 11 | D9: 10 | E9: 4 | F9: 4 | G9: 0 | H9: 2 | I9: 1 | J9: 1 | K9: 4 | L9: 0 | M9: 0 | N9: 1 | O9: =SUM(G9*1+H9*2+I9*3+J9*4)/D9 -> 1.100 | P9: =SUM(F9+L9)/(D9+L9+N9) -> 0.36363636363636365 | Q9: =SUM(F9/D9) -> 00.4
A10: Mills,William | B10: 3 | C10: 9 | D10: 8 | E10: 2 | F10: 3 | G10: 3 | H10: 0 | I10: 0 | J10: 0 | K10: 1 | L10: 1 | M10: 0 | N10: 0 | O10: =SUM(G10*1+H10*2+I10*3+J10*4)/D10 -> 0.375 | P10: =SUM(F10+L10)/(D10+L10+N10) -> 0.44444444444444442 | Q10: =SUM(F10/D10) -> 0.375
A11: Rivera,Greg | B11: 3 | C11: 8 | D11: 8 | E11: 1 | F11: 3 | G11: 2 | H11: 1 | I11: 0 | J11: 0 | K11: 0 | L11: 0 | M11: 0 | N11: 0 | O11: =SUM(G11*1+H11*2+I11*3+J11*4)/D11 -> 0.500 | P11: =SUM(F11+L11)/(D11+L11+N11) -> 0.375 | Q11: =SUM(F11/D11) -> 0.375
A12: Euerle,Dan | B12: 2 | C12: 6 | D12: 6 | E12: 2 | F12: 2 | G12: 1 | H12: 1 | I12: 0 | J12: 0 | K12: 1 | L12: 0 | M12: 0 | N12: 0 | O12: =SUM(G12*1+H12*2+I12*3+J12*4)/D12 -> 0.500 | P12: =SUM(F12+L12)/(D12+L12+N12) -> 0.33333333333333331 | Q12: =SUM(F12/D12) -> 0.33333333333333331
A13: Kostulias,Bob | B13: 3 | C13: 8 | D13: 6 | E13: 1 | F13: 2 | G13: 1 | H13: 1 | I13: 0 | J13: 0 | K13: 1 | L13: 2 | M13: 0 | N13: 0 | O13: =SUM(G13*1+H13*2+I13*3+J13*4)/D13 -> 0.500 | P13: =SUM(F13+L13)/(D13+L13+N13) -> 0.500 | Q13: =SUM(F13/D13) -> 0.33333333333333331
A14: McGuigan,Mike | B14: 1 | C14: 3 | D14: 3 | E14: 1 | F14: 1 | G14: 1 | H14: 0 | I14: 0 | J14: 0 | K14: 0 | L14: 0 | M14: 0 | N14: 0 | O14: =SUM(G14*1+H14*2+I14*3+J14*4)/D14 -> 0.33333333333333331 | P14: =SUM(F14+L14)/(D14+L14+N14) -> 0.33333333333333331 | Q14: =SUM(F14/D14) -> 0.33333333333333331
A15: Rupe,Bob | B15: 3 | C15: 11 | D15: 10 | E15: 4 | F15: 3 | G15: 1 | H15: 2 | I15: 0 | J15: 0 | K15: 1 | L15: 1 | M15: 0 | N15: 0 | O15: =SUM(G15*1+H15*2+I15*3+J15*4)/D15 -> 0.500 | P15: =SUM(F15+L15)/(D15+L15+N15) -> 0.36363636363636365 | Q15: =SUM(F15/D15) -> 00.3
A16: Coen,Mike | B16: 2 | C16: 7 | D16: 7 | E16: 2 | F16: 2 | G16: 0 | H16: 0 | I16: 0 | J16: 2 | K16: 3 | L16: 0 | M16: 0 | N16: 0 | O16: =SUM(G16*1+H16*2+I16*3+J16*4)/D16 -> 1.1428571428571428 | P16: =SUM(F16+L16)/(D16+L16+N16) -> 0.2857142857142857 | Q16: =SUM(F16/D16) -> 0.2857142857142857
A17: Bloom,Adam | B17: 2 | C17: 7 | D17: 5 | E17: 1 | F17: 1 | G17: 1 | H17: 0 | I17: 0 | J17: 0 | K17: 1 | L17: 2 | M17: 0 | N17: 0 | O17: =SUM(G17*1+H17*2+I17*3+J17*4)/D17 -> 00.2 | P17: =SUM(F17+L17)/(D17+L17+N17) -> 0.42857142857142855 | Q17: =SUM(F17/D17) -> 00.2
A18: Sandurs,Eric | B18: 3 | C18: 9 | D18: 6 | E18: 3 | F18: 1 | G18: 1 | H18: 0 | I18: 0 | J18: 0 | K18: 0 | L18: 3 | M18: 0 | N18: 0 | O18: =SUM(G18*1+H18*2+I18*3+J18*4)/D18 -> 0.16666666666666666 | P18: =SUM(F18+L18)/(D18+L18+N18) -> 0.44444444444444442 | Q18: =SUM(F18/D18) -> 0.16666666666666666
A19: Filipski,RJ | B19: 1 | C19: 1 | D19: 1 | E19: 1 | F19: 0 | G19: 0 | H19: 0 | I19: 0 | J19: 0 | K19: 0 | L19: 0 | M19: 0 | N19: 0 | O19: =SUM(G19*1+H19*2+I19*3+J19*4)/D19 -> 0.000 | P19: =SUM(F19+L19)/(D19+L19+N19) -> 0.000 | Q19: =SUM(F19/D19) -> 0.000
A21: TOTALS | B21: 4 | C21: 119 | D21: 106 | E21: 33 | F21: 42 | G21: 26 | H21: 8 | I21: 3 | J21: 5 | K21: 24 | L21: 11 | M21: 0 | N21: 2 | O21: =SUM(G21*1+H21*2+I21*3+J21*4)/D21 -> 0.66981132075471694 | P21: =SUM(F21+L21)/(D21+L21+N21) -> 0.44537815126050423 | Q21: =SUM(F21/D21) -> 0.39622641509433965

E1: FIELDING | F1: POSITION(S)
A2: NAME | B2: PO | C2: A | D2: E | E2: PCT. | F2: PLAYED
A4: Coen,Mike | B4: 5 | C4: 1 | D4: 0 | E4: =SUM(B4+C4)/(B4+C4+D4) -> 1.000 | F4: 2B,EH
A5: Filipski,RJ | B5: 1 | C5: 0 | D5: 0 | E5: =SUM(B5+C5)/(B5+C5+D5) -> 1.000 | F5: C
A6: Miller,Scott | B6: 1 | C6: 0 | D6: 0 | E6: =SUM(B6+C6)/(B6+C6+D6) -> 1.000 | F6: C,EH
A7: Sandurs,Eric | B7: 7 | C7: 1 | D7: 0 | E7: =SUM(B7+C7)/(B7+C7+D7) -> 1.000 | F7: OF
A8: Scheid,Aaron | B8: 3 | C8: 1 | D8: 0 | E8: =SUM(B8+C8)/(B8+C8+D8) -> 1.000 | F8: OF
A9: Stanick,Keith | B9: 2 | C9: 1 | D9: 0 | E9: =SUM(B9+C9)/(B9+C9+D9) -> 1.000 | F9: OF,C,EH
A10: Kostulias,Bob | B10: 0 | C10: 4 | D10: 0 | E10: =SUM(B10+C10)/(B10+C10+D10) -> 1.000 | F10: P
A11: Bloom,Adam | B11: 3 | C11: 4 | D11: 1 | E11: =SUM(B11+C11)/(B11+C11+D11) -> 0.875 | F11: 2B,OF
A12: Rupe,Bob | B12: 17 | C12: 0 | D12: 3 | E12: =SUM(B12+C12)/(B12+C12+D12) -> 00.85 | F12: 1B
A13: Casserly,Pat | B13: 5 | C13: 0 | D13: 1 | E13: =SUM(B13+C13)/(B13+C13+D13) -> 0.83333333333333337 | F13: OF
A14: Casserly,Mike | B14: 7 | C14: 7 | D14: 3 | E14: =SUM(B14+C14)/(B14+C14+D14) -> 0.82352941176470584 | F14: SS
A15: Euerle,Dan | B15: 3 | C15: 5 | D15: 2 | E15: =SUM(B15+C15)/(B15+C15+D15) -> 00.8 | F15: 3B
A16: Rivera,Greg | B16: 3 | C16: 0 | D16: 1 | E16: =SUM(B16+C16)/(B16+C16+D16) -> 0.750 | F16: OF,DH,EH
A17: McGuigan,Mike | B17: 2 | C17: 0 | D17: 1 | E17: =SUM(B17+C17)/(B17+C17+D17) -> 0.66666666666666663 | F17: 2B
A18: Mills,William | B18: 1 | C18: 1 | D18: 1 | E18: =SUM(B18+C18)/(B18+C18+D18) -> 0.66666666666666663 | F18: 3B,C
A20: TOTALS | B20: =SUM(B4:B19) -> 60 | C20: =SUM(C4:C19) -> 25 | D20: =SUM(D4:D19) -> 13 | E20: =SUM(B20+C20)/(B20+C20+D20) -> 0.86734693877551017

M1: OPP.
A2: NAME | B2: G | C2: IP | D2: R | E2: H | F2: ER | G2: BB | H2: SO | I2: W | J2: L | K2: .PCT | L2: ERA | M2: B.AVG.
A4: Bob Kostulias | B4: 3 | C4: 20.00 | D4: 48 | E4: 33 | F4: 28 | G4: 3 | H4: 0 | I4: 2 | J4: 1 | K4: =SUM(I4/B4) -> 0.66666666666666663 | L4: =SUM(F4/C4*7) -> 9.80 | M4: =SUM(E4/(C4*3+E4)) -> 0.35483870967741937
A6: TOTALS | B6: =SUM(B4:B5) -> 3 | C6: 20.00 | D6: =SUM(D4:D5) -> 48 | E6: =SUM(E4:E5) -> 33 | F6: =SUM(F4:F5) -> 28 | G6: =SUM(G4:G5) -> 3 | H6: =SUM(H4:H5) -> 0 | I6: =SUM(I4:I5) -> 2 | J6: =SUM(J4:J5) -> 1 | K6: =SUM(I6/B6) -> 0.66666666666666663 | L6: =SUM(F6/C6*7) -> 9.80 | M6: =SUM(E6/(C6*3+E6)) -> 0.35483870967741937

B2: Click here for 2003 Regular Season Stats