O1: SLUG. | P1: ON BASE | Q1: BATTING
A2: NAME | B2: G | C2: APP | D2: AB | E2: R | F2: H | G2: 1B | H2: 2B | I2: 3B | J2: HR | K2: RBI | L2: BB | M2: K | N2: SAC | O2: PCT. | P2: PCT. | Q2: AVG.
A4: Scheid,Aaron | B4: 9 | C4: 27 | D4: 27 | E4: 11 | F4: 17 | G4: 14 | H4: 1 | I4: 1 | J4: 1 | K4: 6 | L4: 0 | M4: 0 | N4: 0 | O4: =SUM(G4*1+H4*2+I4*3+J4*4)/D4 -> 0.85185185185185186 | P4: =SUM(F4+L4)/(D4+L4+N4) -> 0.62962962962962965 | Q4: =SUM(F4/D4) -> 0.62962962962962965
A5: Casserly,Pat | B5: 10 | C5: 27 | D5: 26 | E5: 4 | F5: 16 | G5: 14 | H5: 1 | I5: 0 | J5: 1 | K5: 7 | L5: 1 | N5: 0 | O5: =SUM(G5*1+H5*2+I5*3+J5*4)/D5 -> 0.76923076923076927 | P5: =SUM(F5+L5)/(D5+L5+N5) -> 0.62962962962962965 | Q5: =SUM(F5/D5) -> 0.61538461538461542
A6: Miller,Scott | B6: 5 | C6: 9 | D6: 9 | E6: 3 | F6: 5 | G6: 5 | H6: 0 | I6: 0 | J6: 0 | K6: 2 | L6: 0 | M6: 0 | N6: 0 | O6: =SUM(G6*1+H6*2+I6*3+J6*4)/D6 -> 0.55555555555555558 | P6: =SUM(F6+L6)/(D6+L6+N6) -> 0.55555555555555558 | Q6: =SUM(F6/D6) -> 0.55555555555555558
A7: Rupe,Bob | B7: 10 | C7: 31 | D7: 30 | E7: 8 | F7: 16 | G7: 10 | H7: 2 | I7: 2 | J7: 2 | K7: 11 | L7: 1 | M7: 1 | N7: 0 | O7: =SUM(G7*1+H7*2+I7*3+J7*4)/D7 -> 0.93333333333333335 | P7: =SUM(F7+L7)/(D7+L7+N7) -> 0.54838709677419351 | Q7: =SUM(F7/D7) -> 0.53333333333333333
A8: Paper,Chris | B8: 3 | C8: 7 | D8: 7 | E8: 1 | F8: 3 | G8: 3 | H8: 0 | I8: 0 | J8: 0 | K8: 2 | L8: 0 | M8: 0 | N8: 0 | O8: =SUM(G8*1+H8*2+I8*3+J8*4)/D8 -> 0.42857142857142855 | P8: =SUM(F8+L8)/(D8+L8+N8) -> 0.42857142857142855 | Q8: =SUM(F8/D8) -> 0.42857142857142855
A9: Stanick,Keith | B9: 10 | C9: 26 | D9: 24 | E9: 7 | F9: 10 | G9: 8 | H9: 0 | I9: 1 | J9: 1 | K9: 6 | L9: 1 | M9: 0 | N9: 1 | O9: =SUM(G9*1+H9*2+I9*3+J9*4)/D9 -> 0.625 | P9: =SUM(F9+L9)/(D9+L9+N9) -> 0.42307692307692307 | Q9: =SUM(F9/D9) -> 0.41666666666666669
A10: Eurele,Dan | B10: 10 | C10: 25 | D10: 25 | E10: 5 | F10: 10 | G10: 9 | H10: 1 | I10: 0 | J10: 0 | K10: 4 | L10: 0 | M10: 1 | N10: 0 | O10: =SUM(G10*1+H10*2+I10*3+J10*4)/D10 -> 00.44 | P10: =SUM(F10+L10)/(D10+L10+N10) -> 00.4 | Q10: =SUM(F10/D10) -> 00.4
A11: Bloom,Adam | B11: 8 | C11: 25 | D11: 21 | E11: 6 | F11: 8 | G11: 6 | H11: 2 | I11: 0 | J11: 0 | K11: 1 | L11: 2 | M11: 0 | N11: 2 | O11: =SUM(G11*1+H11*2+I11*3+J11*4)/D11 -> 0.47619047619047616 | P11: =SUM(F11+L11)/(D11+L11+N11) -> 00.4 | Q11: =SUM(F11/D11) -> 0.38095238095238093
A12: Chin,Vernon | B12: 8 | C12: 22 | D12: 21 | E12: 4 | F12: 8 | G12: 8 | H12: 0 | I12: 0 | J12: 0 | K12: 1 | L12: 1 | M12: 0 | N12: 0 | O12: =SUM(G12*1+H12*2+I12*3+J12*4)/D12 -> 0.38095238095238093 | P12: =SUM(F12+L12)/(D12+L12+N12) -> 0.40909090909090912 | Q12: =SUM(F12/D12) -> 0.38095238095238093
A13: Sandurs,Eric | B13: 7 | C13: 21 | D13: 19 | E13: 7 | F13: 7 | G13: 6 | H13: 0 | I13: 1 | J13: 0 | K13: 4 | L13: 2 | M13: 0 | N13: 0 | O13: =SUM(G13*1+H13*2+I13*3+J13*4)/D13 -> 0.47368421052631576 | P13: =SUM(F13+L13)/(D13+L13+N13) -> 0.42857142857142855 | Q13: =SUM(F13/D13) -> 0.36842105263157893
A14: Rivera,Greg | B14: 6 | C14: 14 | D14: 14 | E14: 4 | F14: 5 | G14: 3 | H14: 2 | I14: 0 | J14: 0 | K14: 2 | L14: 0 | M14: 0 | N14: 0 | O14: =SUM(G14*1+H14*2+I14*3+J14*4)/D14 -> 0.500 | P14: =SUM(F14+L14)/(D14+L14+N14) -> 0.35714285714285715 | Q14: =SUM(F14/D14) -> 0.35714285714285715
A15: Casserly,Mike | B15: 10 | C15: 25 | D15: 24 | E15: 7 | F15: 8 | G15: 7 | H15: 0 | I15: 0 | J15: 1 | K15: 4 | L15: 1 | M15: 0 | N15: 0 | O15: =SUM(G15*1+H15*2+I15*3+J15*4)/D15 -> 0.45833333333333331 | P15: =SUM(F15+L15)/(D15+L15+N15) -> 00.36 | Q15: =SUM(F15/D15) -> 0.33333333333333331
A16: Coen,Mike | B16: 6 | C16: 18 | D16: 18 | E16: 4 | F16: 6 | G16: 2 | H16: 1 | I16: 3 | J16: 0 | K16: 8 | L16: 0 | M16: 0 | N16: 0 | O16: =SUM(G16*1+H16*2+I16*3+J16*4)/D16 -> 0.72222222222222221 | P16: =SUM(F16+L16)/(D16+L16+N16) -> 0.33333333333333331 | Q16: =SUM(F16/D16) -> 0.33333333333333331
A17: Filipski,RJ | B17: 6 | C17: 15 | D17: 15 | E17: 3 | F17: 5 | G17: 5 | H17: 0 | I17: 0 | J17: 0 | K17: 2 | L17: 0 | M17: 0 | N17: 0 | O17: =SUM(G17*1+H17*2+I17*3+J17*4)/D17 -> 0.33333333333333331 | P17: =SUM(F17+L17)/(D17+L17+N17) -> 0.33333333333333331 | Q17: =SUM(F17/D17) -> 0.33333333333333331
A18: Kostulias,Bob | B18: 11 | C18: 28 | D18: 27 | E18: 4 | F18: 9 | G18: 8 | H18: 1 | I18: 0 | J18: 0 | K18: 3 | L18: 1 | M18: 1 | N18: 0 | O18: =SUM(G18*1+H18*2+I18*3+J18*4)/D18 -> 0.37037037037037035 | P18: =SUM(F18+L18)/(D18+L18+N18) -> 0.35714285714285715 | Q18: =SUM(F18/D18) -> 0.33333333333333331
A19: McGuigan,Mike | B19: 2 | C19: 8 | D19: 8 | E19: 2 | F19: 2 | G19: 2 | H19: 0 | I19: 0 | J19: 0 | K19: 1 | L19: 0 | M19: 0 | N19: 0 | O19: =SUM(G19*1+H19*2+I19*3+J19*4)/D19 -> 0.250 | P19: =SUM(F19+L19)/(D19+L19+N19) -> 0.250 | Q19: =SUM(F19/D19) -> 0.250
A20: Mills,William | B20: 4 | C20: 8 | D20: 8 | E20: 2 | F20: 2 | G20: 2 | H20: 0 | I20: 0 | J20: 0 | K20: 0 | L20: 0 | M20: 0 | N20: 0 | O20: =SUM(G20*1+H20*2+I20*3+J20*4)/D20 -> 0.250 | P20: =SUM(F20+L20)/(D20+L20+N20) -> 0.250 | Q20: =SUM(F20/D20) -> 0.250
A21: Hernandez,Alberto | B21: 8 | C21: 26 | D21: 26 | E21: 4 | F21: 7 | G21: 5 | H21: 1 | I21: 1 | J21: 0 | K21: 4 | L21: 0 | M21: 0 | N21: 0 | O21: =SUM(G21*1+H21*2+I21*3+J21*4)/D21 -> 0.38461538461538464 | P21: =SUM(F21+L21)/(D21+L21+N21) -> 0.26923076923076922 | Q21: =SUM(F21/D21) -> 0.26923076923076922
A22: Picciano,Justin | B22: 4 | C22: 9 | D22: 9 | E22: 1 | F22: 2 | G22: 2 | H22: 0 | I22: 0 | J22: 0 | K22: 1 | L22: 0 | M22: 0 | N22: 0 | O22: =SUM(G22*1+H22*2+I22*3+J22*4)/D22 -> 0.22222222222222221 | P22: =SUM(F22+L22)/(D22+L22+N22) -> 0.22222222222222221 | Q22: =SUM(F22/D22) -> 0.22222222222222221
A23: Leonard,John | B23: 1 | C23: 1 | D23: 1 | E23: 0 | F23: 0 | G23: 0 | H23: 0 | I23: 0 | J23: 0 | K23: 0 | L23: 0 | M23: 0 | N23: 0 | O23: =SUM(G23*1+H23*2+I23*3+J23*4)/D23 -> 0.000 | P23: =SUM(F23+L23)/(D23+L23+N23) -> 0.000 | Q23: =SUM(F23/D23) -> 0.000
A25: TOTALS | B25: 12 | C25: =SUM(C4:C23) -> 372 | D25: =SUM(D4:D23) -> 359 | E25: =SUM(E4:E23) -> 87 | F25: =SUM(F4:F23) -> 146 | G25: =SUM(G4:G23) -> 119 | H25: =SUM(H4:H23) -> 12 | I25: =SUM(I4:I23) -> 9 | J25: =SUM(J4:J23) -> 6 | K25: =SUM(K4:K23) -> 69 | L25: =SUM(L4:L23) -> 10 | M25: =SUM(M4:M23) -> 3 | N25: =SUM(N4:N23) -> 3 | O25: =SUM(G25*1+H25*2+I25*3+J25*4)/D25 -> 0.54038997214484674 | P25: =SUM(F25+L25)/(D25+L25+N25) -> 0.41935483870967744 | Q25: =SUM(F25/D25) -> 0.40668523676880225

E1: FIELDING | F1: POSITION(S)
A2: NAME | B2: PO | C2: A | D2: E | E2: PCT. | F2: PLAYED
A4: Coen,Mike | B4: 2 | C4: 1 | D4: 0 | E4: =SUM(B4+C4)/(B4+C4+D4) -> 1.000 | F4: OF,2B,DH,EH
A5: Kostulias,Bob | B5: 1 | C5: 14 | D5: 0 | E5: =SUM(B5+C5)/(B5+C5+D5) -> 1.000 | F5: P
A6: McGuigan,Mike | B6: 2 | C6: 0 | D6: 0 | E6: =SUM(B6+C6)/(B6+C6+D6) -> 1.000 | F6: OF
A7: Miller,Scott | B7: 1 | C7: 0 | D7: 0 | E7: =SUM(B7+C7)/(B7+C7+D7) -> 1.000 | F7: C,EH,OF
A8: Paper,Chris | B8: 4 | C8: 1 | D8: 0 | E8: =SUM(B8+C8)/(B8+C8+D8) -> 1.000 | F8: C,OF
A9: Picciano,Justin | B9: 6 | C9: 0 | D9: 0 | E9: =SUM(B9+C9)/(B9+C9+D9) -> 1.000 | F9: C,1B,OF
A10: Scheid,Aaron | B10: 5 | C10: 1 | D10: 0 | E10: =SUM(B10+C10)/(B10+C10+D10) -> 1.000 | F10: OF,DH,EH
A11: Rupe,Bob | B11: 53 | C11: 0 | D11: 1 | E11: =SUM(B11+C11)/(B11+C11+D11) -> 0.98148148148148151 | F11: 1B
A12: Bloom,Adam | B12: 17 | C12: 13 | D12: 2 | E12: =SUM(B12+C12)/(B12+C12+D12) -> 0.9375 | F12: OF,2B
A13: Casserly,Pat | B13: 25 | C13: 1 | D13: 2 | E13: =SUM(B13+C13)/(B13+C13+D13) -> 0.9285714285714286 | F13: OF
A14: Hernandez,Alberto | B14: 10 | C14: 1 | D14: 1 | E14: =SUM(B14+C14)/(B14+C14+D14) -> 0.91666666666666663 | F14: C,3B,2B,DH
A15: Eurele,Dan | B15: 18 | C15: 15 | D15: 4 | E15: =SUM(B15+C15)/(B15+C15+D15) -> 0.89189189189189189 | F15: 3B,SS,OF
A16: Sandurs,Eric | B16: 14 | C16: 0 | D16: 2 | E16: =SUM(B16+C16)/(B16+C16+D16) -> 0.875 | F16: OF
A17: Stanick,Keith | B17: 6 | C17: 1 | D17: 1 | E17: =SUM(B17+C17)/(B17+C17+D17) -> 0.875 | F17: OF,EH
A18: Casserly,Mike | B18: 15 | C18: 26 | D18: 7 | E18: =SUM(B18+C18)/(B18+C18+D18) -> 0.85416666666666663 | F18: SS
A19: Rivera,Greg | B19: 3 | C19: 1 | D19: 1 | E19: =SUM(B19+C19)/(B19+C19+D19) -> 00.8 | F19: OF,EH
A20: Mills,William | B20: 1 | C20: 1 | D20: 1 | E20: =SUM(B20+C20)/(B20+C20+D20) -> 0.66666666666666663 | F20: C,3B
A21: Chin,Vernon | B21: 0 | C21: 0 | D21: 0 | E21: 0.000 | F21: C,DH,EH
A22: Filipski,RJ | B22: 0 | C22: 1 | D22: 0 | E22: =SUM(B22+C22)/(B22+C22+D22) -> 1.000 | F22: C,DH,EH
A23: Leonard,John | B23: 0 | C23: 0 | D23: 0 | E23: 0.000 | F23: EH
A25: TOTALS | B25: =SUM(B4:B24) -> 183 | C25: =SUM(C4:C24) -> 77 | D25: =SUM(D4:D24) -> 22 | E25: =SUM(B25+C25)/(B25+C25+D25) -> 0.92198581560283688

M1: OPP.
A2: NAME | B2: G | C2: IP | D2: R | E2: H | F2: ER | G2: BB | H2: SO | I2: W | J2: L | K2: .PCT | L2: ERA | M2: B.AVG.
A4: Bob Kostulias | B4: 11 | C4: 60.00 | D4: 102 | E4: 42 | F4: 32 | G4: 6 | H4: 5 | I4: 7 | J4: 4 | K4: =SUM(I4/B4) -> 0.63636363636363635 | L4: =SUM(F4/C4*7) -> 3.7333333333333334 | M4: =SUM(E4/(C4*3+E4)) -> 0.1891891891891892
A6: TOTALS | B6: =SUM(B4:B5) -> 11 | C6: 60.00 | D6: =SUM(D4:D5) -> 102 | E6: =SUM(E4:E5) -> 42 | F6: =SUM(F4:F5) -> 32 | G6: =SUM(G4:G5) -> 6 | H6: =SUM(H4:H5) -> 5 | I6: =SUM(I4:I5) -> 7 | J6: =SUM(J4:J5) -> 4 | K6: =SUM(I6/B6) -> 0.63636363636363635 | L6: =SUM(F6/C6*7) -> 3.7333333333333334 | M6: =SUM(E6/(C6*3+E6)) -> 0.1891891891891892

B2: Click here for 2003 Post-Season Stats