A1: Stats > 2004 > Post-Season | B1: Printer-Friendly

O1: SLUG. | P1: ON BASE | Q1: BATTING
A2: NAME | B2: G | C2: APP | D2: AB | E2: R | F2: H | G2: 1B | H2: 2B | I2: 3B | J2: HR | K2: RBI | L2: BB | M2: K | N2: SAC | O2: PCT. | P2: PCT. | Q2: AVG.
A4: Chin,Vernon | B4: 1 | C4: 3 | D4: 3 | E4: 0 | F4: 3 | G4: 3 | H4: 0 | I4: 0 | J4: 0 | K4: 0 | L4: 0 | M4: 0 | N4: 0 | O4: =SUM(G4*1+H4*2+I4*3+J4*4)/D4 -> 1.000 | P4: =SUM(F4+L4)/(D4+L4+N4) -> 1.000 | Q4: =SUM(F4/D4) -> 1.000
A5: Kostulias,Bob | B5: 1 | C5: 2 | D5: 1 | E5: 0 | F5: 1 | G5: 1 | H5: 0 | I5: 0 | J5: 0 | K5: 0 | L5: 0 | M5: 0 | N5: 0 | O5: =SUM(G5*1+H5*2+I5*3+J5*4)/D5 -> 1.000 | P5: =SUM(F5+L5)/(D5+L5+N5) -> 1.000 | Q5: =SUM(F5/D5) -> 1.000
A6: Sandurs,Eric | B6: 1 | C6: 3 | D6: 3 | E6: 0 | F6: 2 | G6: 2 | H6: 0 | I6: 0 | J6: 0 | K6: 0 | L6: 0 | M6: 0 | N6: 0 | O6: =SUM(G6*1+H6*2+I6*3+J6*4)/D6 -> 0.66666666666666663 | P6: =SUM(F6+L6)/(D6+L6+N6) -> 0.66666666666666663 | Q6: =SUM(F6/D6) -> 0.66666666666666663
A7: Euerle,Dan | B7: 1 | C7: 2 | D7: 2 | E7: 0 | F7: 1 | G7: 1 | H7: 0 | I7: 0 | J7: 0 | K7: 0 | L7: 0 | M7: 0 | N7: 0 | O7: =SUM(G7*1+H7*2+I7*3+J7*4)/D7 -> 0.500 | P7: =SUM(F7+L7)/(D7+L7+N7) -> 0.500 | Q7: =SUM(F7/D7) -> 0.500
A8: Rupe,Bob | B8: 1 | C8: 3 | D8: 3 | E8: 0 | F8: 1 | G8: 0 | H8: 0 | I8: 1 | J8: 0 | K8: 1 | L8: 0 | M8: 0 | N8: 0 | O8: =SUM(G8*1+H8*2+I8*3+J8*4)/D8 -> 1.000 | P8: =SUM(F8+L8)/(D8+L8+N8) -> 0.33333333333333331 | Q8: =SUM(F8/D8) -> 0.33333333333333331
A9: Stanick,Keith | B9: 1 | C9: 3 | D9: 3 | E9: 0 | F9: 1 | G9: 1 | H9: 0 | I9: 0 | J9: 0 | K9: 0 | L9: 0 | M9: 0 | N9: 0 | O9: =SUM(G9*1+H9*2+I9*3+J9*4)/D9 -> 0.33333333333333331 | P9: =SUM(F9+L9)/(D9+L9+N9) -> 0.33333333333333331 | Q9: =SUM(F9/D9) -> 0.33333333333333331
A10: Bloom,Adam | B10: 1 | C10: 3 | D10: 3 | E10: 0 | F10: 0 | G10: 0 | H10: 0 | I10: 0 | J10: 0 | K10: 0 | L10: 0 | M10: 0 | N10: 0 | O10: =SUM(G10*1+H10*2+I10*3+J10*4)/D10 -> 0.000 | P10: =SUM(F10+L10)/(D10+L10+N10) -> 0.000 | Q10: =SUM(F10/D10) -> 0.000
A11: Casserly,Mike | B11: 1 | C11: 2 | D11: 2 | E11: 0 | F11: 0 | G11: 0 | H11: 0 | I11: 0 | J11: 0 | K11: 0 | L11: 0 | M11: 0 | N11: 0 | O11: =SUM(G11*1+H11*2+I11*3+J11*4)/D11 -> 0.000 | P11: =SUM(F11+L11)/(D11+L11+N11) -> 0.000 | Q11: =SUM(F11/D11) -> 0.000
A12: Follo,Shaun | B12: 1 | C12: 2 | D12: 2 | E12: 0 | F12: 0 | G12: 0 | H12: 0 | I12: 0 | J12: 0 | K12: 0 | L12: 0 | M12: 0 | N12: 0 | O12: =SUM(G12*1+H12*2+I12*3+J12*4)/D12 -> 0.000 | P12: =SUM(F12+L12)/(D12+L12+N12) -> 0.000 | Q12: =SUM(F12/D12) -> 0.000
A13: Miller,Scott | B13: 1 | C13: 3 | D13: 3 | E13: 1 | F13: 0 | G13: 0 | H13: 0 | I13: 0 | J13: 0 | K13: 0 | L13: 0 | M13: 0 | N13: 0 | O13: =SUM(G13*1+H13*2+I13*3+J13*4)/D13 -> 0.000 | P13: =SUM(F13+L13)/(D13+L13+N13) -> 0.000 | Q13: =SUM(F13/D13) -> 0.000
A14: Picciano,Justin | B14: 1 | C14: 2 | D14: 2 | E14: 0 | F14: 0 | G14: 0 | H14: 0 | I14: 0 | J14: 0 | K14: 0 | L14: 0 | M14: 0 | N14: 0 | O14: =SUM(G14*1+H14*2+I14*3+J14*4)/D14 -> 0.000 | P14: =SUM(F14+L14)/(D14+L14+N14) -> 0.000 | Q14: =SUM(F14/D14) -> 0.000
A15: Rivera,Greg | B15: 1 | C15: 2 | D15: 2 | E15: 0 | F15: 0 | G15: 0 | H15: 0 | I15: 0 | J15: 0 | K15: 0 | L15: 0 | M15: 0 | N15: 0 | O15: =SUM(G15*1+H15*2+I15*3+J15*4)/D15 -> 0.000 | P15: =SUM(F15+L15)/(D15+L15+N15) -> 0.000 | Q15: =SUM(F15/D15) -> 0.000
A17: TOTALS | B17: 1 | C17: =SUM(C4:C15) -> 30 | D17: =SUM(D4:D15) -> 29 | E17: =SUM(E4:E15) -> 1 | F17: =SUM(F4:F15) -> 9 | G17: =SUM(G4:G15) -> 8 | H17: =SUM(H4:H15) -> 0 | I17: =SUM(I4:I15) -> 1 | J17: =SUM(J4:J15) -> 0 | K17: =SUM(K4:K15) -> 1 | L17: =SUM(L4:L15) -> 0 | M17: =SUM(M4:M15) -> 0 | N17: =SUM(N4:N15) -> 0 | O17: =SUM(G17*1+H17*2+I17*3+J17*4)/D17 -> 0.37931034482758619 | P17: =SUM(F17+L17)/(D17+L17+N17) -> 0.31034482758620691 | Q17: =SUM(F17/D17) -> 0.31034482758620691

E1: FIELDING | F1: POSITION(S)
A2: NAME | B2: PO | C2: A | D2: E | E2: PCT. | F2: PLAYED
A4: Bloom,Adam | B4: 4 | C4: 0 | D4: 0 | E4: =SUM(B4+C4)/(B4+C4+D4) -> 1.000 | F4: OF
A5: Euerle,Dan | B5: 0 | C5: 1 | D5: 0 | E5: =SUM(B5+C5)/(B5+C5+D5) -> 1.000 | F5: 3B
A6: Kostulias,Bob | B6: 0 | C6: 2 | D6: 0 | E6: =SUM(B6+C6)/(B6+C6+D6) -> 1.000 | F6: P
A7: Miller,Scott | B7: 1 | C7: 0 | D7: 0 | E7: =SUM(B7+C7)/(B7+C7+D7) -> 1.000 | F7: 2B
A8: Rivera,Greg | B8: 2 | C8: 0 | D8: 0 | E8: =SUM(B8+C8)/(B8+C8+D8) -> 1.000 | F8: OF
A9: Rupe,Bob | B9: 3 | C9: 0 | D9: 0 | E9: =SUM(B9+C9)/(B9+C9+D9) -> 1.000 | F9: 1B
A10: Sandurs,Eric | B10: 4 | C10: 0 | D10: 0 | E10: =SUM(B10+C10)/(B10+C10+D10) -> 1.000 | F10: OF
A11: Casserly,Mike | B11: 4 | C11: 0 | D11: 2 | E11: =SUM(B11+C11)/(B11+C11+D11) -> 0.66666666666666663 | F11: SS
A12: Chin,Vernon | B12: 0 | C12: 0 | D12: 0 | E12: 0.000 | F12: EH
A13: Follo,Shaun | B13: 0 | C13: 0 | D13: 0 | E13: 0.000 | F13: OF
A14: Picciano,Justin | B14: 0 | C14: 0 | D14: 0 | E14: 0.000 | F14: DH
A15: Stanick,Keith | B15: 0 | C15: 0 | D15: 0 | E15: 0.000 | F15: C
A17: TOTALS | B17: =SUM(B4:B16) -> 18 | C17: =SUM(C4:C16) -> 3 | D17: =SUM(D4:D16) -> 2 | E17: =SUM(B17+C17)/(B17+C17+D17) -> 0.91304347826086951

M1: OPP.
A2: NAME | B2: G | C2: IP | D2: R | E2: H | F2: ER | G2: BB | H2: SO | I2: W | J2: L | K2: .PCT | L2: ERA | M2: B.AVG.
A4: Bob Kostulias | B4: 1 | C4: 6.00 | D4: 5 | E4: 9 | F4: 1 | G4: 1 | H4: 0 | I4: 0 | J4: 1 | K4: =SUM(I4/B4) -> 0.000 | L4: =SUM(F4/C4*7) -> 1.1666666666666665 | M4: =SUM(E4/(C4*3+E4)) -> 0.33333333333333331
A6: TOTALS | B6: =SUM(B4:B5) -> 1 | C6: 6.00 | D6: =SUM(D4:D5) -> 5 | E6: =SUM(E4:E5) -> 9 | F6: =SUM(F4:F5) -> 1 | G6: =SUM(G4:G5) -> 1 | H6: =SUM(H4:H5) -> 0 | I6: =SUM(I4:I5) -> 0 | J6: =SUM(J4:J5) -> 1 | K6: =SUM(I6/B6) -> 0.000 | L6: =SUM(F6/C6*7) -> 1.1666666666666665 | M6: =SUM(E6/(C6*3+E6)) -> 0.33333333333333331

B2: Click here for 2004 Regular Season Stats