A1: Stats > 2004 > Regular Season | B1: Printer-Friendly

O1: SLUG. | P1: ON BASE | Q1: BATTING
A2: NAME | B2: G | C2: APP | D2: AB | E2: R | F2: H | G2: 1B | H2: 2B | I2: 3B | J2: HR | K2: RBI | L2: BB | M2: K | N2: SAC | O2: PCT. | P2: PCT. | Q2: AVG.
A4: Miller,Scott | B4: 8 | C4: 24 | D4: 22 | E4: 5 | F4: 12 | G4: 11 | H4: 1 | I4: 0 | J4: 0 | K4: 7 | L4: 1 | M4: 0 | N4: 1 | O4: =SUM(G4*1+H4*2+I4*3+J4*4)/D4 -> 0.59090909090909094 | P4: =SUM(F4+L4)/(D4+L4+N4) -> 0.54166666666666663 | Q4: =SUM(F4/D4) -> 0.54545454545454541
A5: Coen,Mike | B5: 3 | C5: 9 | D5: 8 | E5: 4 | F5: 4 | G5: 3 | H5: 1 | I5: 0 | J5: 0 | K5: 3 | L5: 1 | M5: 0 | N5: 0 | O5: =SUM(G5*1+H5*2+I5*3+J5*4)/D5 -> 0.625 | P5: =SUM(F5+L5)/(D5+L5+N5) -> 0.55555555555555558 | Q5: =SUM(F5/D5) -> 0.500
A6: Hernandez,Alberto | B6: 2 | C6: 4 | D6: 4 | E6: 1 | F6: 2 | G6: 2 | H6: 0 | I6: 0 | J6: 0 | K6: 0 | L6: 0 | M6: 0 | N6: 0 | O6: =SUM(G6*1+H6*2+I6*3+J6*4)/D6 -> 0.500 | P6: =SUM(F6+L6)/(D6+L6+N6) -> 0.500 | Q6: =SUM(F6/D6) -> 0.500
A7: Rupe,Bob | B7: 10 | C7: 35 | D7: 33 | E7: 9 | F7: 16 | G7: 13 | H7: 2 | I7: 1 | J7: 0 | K7: 9 | L7: 1 | M7: 0 | N7: 1 | O7: =SUM(G7*1+H7*2+I7*3+J7*4)/D7 -> 0.60606060606060608 | P7: =SUM(F7+L7)/(D7+L7+N7) -> 0.48571428571428571 | Q7: =SUM(F7/D7) -> 0.48484848484848486
A8: Follo,Shaun | B8: 8 | C8: 26 | D8: 23 | E8: 6 | F8: 11 | G8: 11 | H8: 0 | I8: 0 | J8: 0 | K8: 3 | L8: 0 | M8: 0 | N8: 3 | O8: =SUM(G8*1+H8*2+I8*3+J8*4)/D8 -> 0.47826086956521741 | P8: =SUM(F8+L8)/(D8+L8+N8) -> 0.42307692307692307 | Q8: =SUM(F8/D8) -> 0.47826086956521741
A9: Scheid,Aaron | B9: 5 | C9: 17 | D9: 17 | E9: 3 | F9: 8 | G9: 8 | H9: 0 | I9: 0 | J9: 0 | K9: 1 | L9: 0 | M9: 0 | N9: 0 | O9: =SUM(G9*1+H9*2+I9*3+J9*4)/D9 -> 0.47058823529411764 | P9: =SUM(F9+L9)/(D9+L9+N9) -> 0.47058823529411764 | Q9: =SUM(F9/D9) -> 0.47058823529411764
A10: Casserly,Pat | B10: 10 | C10: 32 | D10: 30 | E10: 10 | F10: 14 | G10: 13 | H10: 1 | I10: 0 | J10: 0 | K10: 0 | L10: 2 | M10: 2 | N10: 0 | O10: =SUM(G10*1+H10*2+I10*3+J10*4)/D10 -> 0.500 | P10: =SUM(F10+L10)/(D10+L10+N10) -> 0.500 | Q10: =SUM(F10/D10) -> 0.46666666666666667
A11: Stanick,Keith | B11: 9 | C11: 30 | D11: 26 | E11: 5 | F11: 11 | G11: 11 | H11: 0 | I11: 0 | J11: 0 | K11: 3 | L11: 2 | M11: 0 | N11: 2 | O11: =SUM(G11*1+H11*2+I11*3+J11*4)/D11 -> 0.42307692307692307 | P11: =SUM(F11+L11)/(D11+L11+N11) -> 0.43333333333333335 | Q11: =SUM(F11/D11) -> 0.42307692307692307
A12: Sandurs,Eric | B12: 8 | C12: 24 | D12: 22 | E12: 3 | F12: 8 | G12: 7 | H12: 1 | I12: 0 | J12: 0 | K12: 4 | L12: 2 | M12: 0 | N12: 0 | O12: =SUM(G12*1+H12*2+I12*3+J12*4)/D12 -> 0.40909090909090912 | P12: =SUM(F12+L12)/(D12+L12+N12) -> 0.41666666666666669 | Q12: =SUM(F12/D12) -> 0.36363636363636365
A13: Weaver,R.J. | B13: 2 | C13: 6 | D13: 6 | E13: 1 | F13: 2 | G13: 2 | H13: 0 | I13: 0 | J13: 0 | K13: 0 | L13: 0 | M13: 0 | N13: 0 | O13: =SUM(G13*1+H13*2+I13*3+J13*4)/D13 -> 0.33333333333333331 | P13: =SUM(F13+L13)/(D13+L13+N13) -> 0.33333333333333331 | Q13: =SUM(F13/D13) -> 0.33333333333333331
A14: Euerle,Dan | B14: 12 | C14: 35 | D14: 34 | E14: 5 | F14: 11 | G14: 10 | H14: 0 | I14: 0 | J14: 1 | K14: 8 | L14: 1 | M14: 1 | N14: 0 | O14: =SUM(G14*1+H14*2+I14*3+J14*4)/D14 -> 0.41176470588235292 | P14: =SUM(F14+L14)/(D14+L14+N14) -> 0.34285714285714286 | Q14: =SUM(F14/D14) -> 0.3235294117647059
A15: Rivera,Greg | B15: 6 | C15: 17 | D15: 17 | E15: 0 | F15: 5 | G15: 5 | H15: 0 | I15: 0 | J15: 0 | K15: 3 | L15: 0 | M15: 0 | N15: 0 | O15: =SUM(G15*1+H15*2+I15*3+J15*4)/D15 -> 0.29411764705882354 | P15: =SUM(F15+L15)/(D15+L15+N15) -> 0.29411764705882354 | Q15: =SUM(F15/D15) -> 0.29411764705882354
A16: Casserly,Mike | B16: 12 | C16: 34 | D16: 33 | E16: 3 | F16: 9 | G16: 8 | H16: 1 | I16: 0 | J16: 0 | K16: 3 | L16: 1 | M16: 0 | N16: 0 | O16: =SUM(G16*1+H16*2+I16*3+J16*4)/D16 -> 0.30303030303030304 | P16: =SUM(F16+L16)/(D16+L16+N16) -> 0.29411764705882354 | Q16: =SUM(F16/D16) -> 0.27272727272727271
A17: Filipski,R.J. | B17: 9 | C17: 24 | D17: 23 | E17: 5 | F17: 6 | G17: 5 | H17: 0 | I17: 1 | J17: 0 | K17: 3 | L17: 0 | M17: 0 | N17: 1 | O17: =SUM(G17*1+H17*2+I17*3+J17*4)/D17 -> 0.34782608695652173 | P17: =SUM(F17+L17)/(D17+L17+N17) -> 0.250 | Q17: =SUM(F17/D17) -> 0.2608695652173913
A18: Chin,Vernon | B18: 11 | C18: 35 | D18: 35 | E18: 2 | F18: 9 | G18: 9 | H18: 0 | I18: 0 | J18: 0 | K18: 8 | L18: 0 | M18: 0 | N18: 0 | O18: =SUM(G18*1+H18*2+I18*3+J18*4)/D18 -> 0.25714285714285712 | P18: =SUM(F18+L18)/(D18+L18+N18) -> 0.25714285714285712 | Q18: =SUM(F18/D18) -> 0.25714285714285712
A19: Bloom,Adam | B19: 9 | C19: 26 | D19: 20 | E19: 8 | F19: 5 | G19: 2 | H19: 0 | I19: 2 | J19: 1 | K19: 3 | L19: 6 | M19: 0 | N19: 0 | O19: =SUM(G19*1+H19*2+I19*3+J19*4)/D19 -> 0.600 | P19: =SUM(F19+L19)/(D19+L19+N19) -> 0.42307692307692307 | Q19: =SUM(F19/D19) -> 0.250
A20: Picciano,Justin | B20: 4 | C20: 9 | D20: 8 | E20: 1 | F20: 2 | G20: 1 | H20: 1 | I20: 0 | J20: 0 | K20: 1 | L20: 1 | M20: 0 | N20: 0 | O20: =SUM(G20*1+H20*2+I20*3+J20*4)/D20 -> 0.375 | P20: =SUM(F20+L20)/(D20+L20+N20) -> 0.33333333333333331 | Q20: =SUM(F20/D20) -> 0.250
A21: Kostulias,Bob | B21: 11 | C21: 29 | D21: 21 | E21: 5 | F21: 3 | G21: 3 | H21: 0 | I21: 0 | J21: 0 | K21: 0 | L21: 8 | M21: 4 | N21: 0 | O21: =SUM(G21*1+H21*2+I21*3+J21*4)/D21 -> 0.14285714285714285 | P21: =SUM(F21+L21)/(D21+L21+N21) -> 0.37931034482758619 | Q21: =SUM(F21/D21) -> 0.14285714285714285
A23: TOTALS | B23: 12 | C23: =SUM(C4:C22) -> 416 | D23: =SUM(D4:D22) -> 382 | E23: =SUM(E4:E22) -> 76 | F23: =SUM(F4:F22) -> 138 | G23: =SUM(G4:G22) -> 124 | H23: =SUM(H4:H22) -> 8 | I23: =SUM(I4:I22) -> 4 | J23: =SUM(J4:J22) -> 2 | K23: =SUM(K4:K22) -> 59 | L23: =SUM(L4:L22) -> 26 | M23: =SUM(M4:M22) -> 7 | N23: =SUM(N4:N22) -> 8 | O23: =SUM(G23*1+H23*2+I23*3+J23*4)/D23 -> 0.41884816753926701 | P23: =SUM(F23+L23)/(D23+L23+N23) -> 0.39423076923076922 | Q23: =SUM(F23/D23) -> 0.36125654450261779

E1: FIELDING | F1: POSITION(S)
A2: NAME | B2: PO | C2: A | D2: E | E2: PCT. | F2: PLAYED
A4: Chin,Vernon | B4: 1 | C4: 0 | D4: 0 | E4: =SUM(B4+C4)/(B4+C4+D4) -> 1.000 | F4: C,DH,EH
A5: Picciano,Justin | B5: 2 | C5: 1 | D5: 0 | E5: =SUM(B5+C5)/(B5+C5+D5) -> 1.000 | F5: OF
A6: Rivera,Greg | B6: 4 | C6: 0 | D6: 0 | E6: =SUM(B6+C6)/(B6+C6+D6) -> 1.000 | F6: OF
A7: Sandurs,Eric | B7: 13 | C7: 1 | D7: 0 | E7: =SUM(B7+C7)/(B7+C7+D7) -> 1.000 | F7: OF
A8: Scheid,Aaron | B8: 9 | C8: 1 | D8: 0 | E8: =SUM(B8+C8)/(B8+C8+D8) -> 1.000 | F8: OF,1B
A9: Casserly,Pat | B9: 28 | C9: 3 | D9: 1 | E9: =SUM(B9+C9)/(B9+C9+D9) -> 0.96875 | F9: OF
A10: Stanick,Keith | B10: 18 | C10: 1 | D10: 1 | E10: =SUM(B10+C10)/(B10+C10+D10) -> 0.950 | F10: OF,1B,C,P,DH
A11: Kostulias,Bob | B11: 2 | C11: 15 | D11: 1 | E11: =SUM(B11+C11)/(B11+C11+D11) -> 0.94444444444444442 | F11: P
A12: Follo,Shaun | B12: 14 | C12: 1 | D12: 1 | E12: =SUM(B12+C12)/(B12+C12+D12) -> 0.9375 | F12: OF
A13: Miller,Scott | B13: 11 | C13: 4 | D13: 1 | E13: =SUM(B13+C13)/(B13+C13+D13) -> 0.9375 | F13: C,OF,2B
A14: Rupe,Bob | B14: 41 | C14: 0 | D14: 3 | E14: =SUM(B14+C14)/(B14+C14+D14) -> 0.93181818181818177 | F14: 1B
A15: Bloom,Adam | B15: 25 | C15: 20 | D15: 5 | E15: =SUM(B15+C15)/(B15+C15+D15) -> 0.900 | F15: 2B,OF
A16: Euerle,Dan | B16: 24 | C16: 22 | D16: 6 | E16: =SUM(B16+C16)/(B16+C16+D16) -> 0.88461538461538458 | F16: 3B
A17: Casserly,Mike | B17: 39 | C17: 34 | D17: 10 | E17: =SUM(B17+C17)/(B17+C17+D17) -> 0.87951807228915657 | F17: SS
A18: Coen,Mike | B18: 7 | C18: 4 | D18: 2 | E18: =SUM(B18+C18)/(B18+C18+D18) -> 0.84615384615384615 | F18: 2B,1B,EH
A19: Filipski,R.J. | B19: 4 | C19: 1 | D19: 1 | E19: =SUM(B19+C19)/(B19+C19+D19) -> 0.83333333333333337 | F19: C,OF
A20: Hernandez,Alberto | B20: 0 | C20: 0 | D20: 0 | E20: 0.000 | F20: OF,DH
A21: Weaver, R.J. | B21: 1 | C21: 0 | D21: 0 | E21: =SUM(B21+C21)/(B21+C21+D21) -> 1.000 | F21: OF
A23: TOTALS | B23: =SUM(B4:B22) -> 243 | C23: =SUM(C4:C22) -> 108 | D23: =SUM(D4:D22) -> 32 | E23: =SUM(B23+C23)/(B23+C23+D23) -> 0.91644908616187992

M1: OPP.
A2: NAME | B2: G | C2: IP | D2: R | E2: H | F2: ER | G2: BB | H2: SO | I2: W | J2: L | K2: .PCT | L2: ERA | M2: B.AVG.
A4: Bob Kostulias | B4: 11 | C4: 74.00 | D4: 59 | E4: 116 | F4: 46 | G4: 7 | H4: 4 | I4: 7 | J4: 4 | K4: =SUM(I4/B4) -> 0.63636363636363635 | L4: =SUM(F4/C4*7) -> 4.3513513513513509 | M4: =SUM(E4/(C4*3+E4)) -> 0.34319526627218933
A6: Keith Stancik | B6: 1 | C6: 7.00 | D6: 0 | E6: 7 | F6: 0 | G6: 1 | H6: 1 | I6: 1 | J6: 0 | K6: =SUM(I6/B6) -> 1.000 | L6: =SUM(F6/C6*7) -> 0.00 | M6: =SUM(E6/(C6*3+E6)) -> 0.250
A8: TOTALS | B8: 12 | C8: 81.00 | D8: 59 | E8: 123 | F8: 46 | G8: 8 | H8: 5 | I8: 8 | J8: 4 | K8: =SUM(I8/B8) -> 0.66666666666666663 | L8: =SUM(F8/C8*7) -> 3.9753086419753085 | M8: =SUM(E8/(C8*3+E8)) -> 0.33606557377049179

B2: Click here for 2004 Post-Season Stats