A1: Stats > 2005 > Post-Season | B1: Printer-Friendly

O1: SLUG. | P1: ON BASE | Q1: BATTING
A2: NAME | B2: G | C2: APP | D2: AB | E2: R | F2: H | G2: 1B | H2: 2B | I2: 3B | J2: HR | K2: RBI | L2: BB | M2: K | N2: SAC | O2: PCT. | P2: PCT. | Q2: AVG.
A4: Bloom,Adam | B4: 1 | C4: 3 | D4: 2 | E4: 0 | F4: 1 | G4: 0 | H4: 0 | I4: 1 | J4: 0 | K4: 1 | L4: 1 | M4: 0 | N4: 0 | O4: =SUM(G4*1+H4*2+I4*3+J4*4)/D4 -> 1.500 | P4: =SUM(F4+L4)/(D4+L4+N4) -> 0.66666666666666663 | Q4: =SUM(F4/D4) -> 0.500
A5: Coen,Mike | B5: 1 | C5: 3 | D5: 3 | E5: 1 | F5: 1 | G5: 0 | H5: 0 | I5: 0 | J5: 1 | K5: 3 | L5: 0 | M5: 0 | N5: 0 | O5: =SUM(G5*1+H5*2+I5*3+J5*4)/D5 -> 1.3333333333333333 | P5: =SUM(F5+L5)/(D5+L5+N5) -> 0.33333333333333331 | Q5: =SUM(F5/D5) -> 0.33333333333333331
A6: Eurele,Dan | B6: 1 | C6: 3 | D6: 3 | E6: 1 | F6: 1 | G6: 1 | H6: 0 | I6: 0 | J6: 0 | K6: 0 | L6: 0 | M6: 0 | N6: 0 | O6: =SUM(G6*1+H6*2+I6*3+J6*4)/D6 -> 0.33333333333333331 | P6: =SUM(F6+L6)/(D6+L6+N6) -> 0.33333333333333331 | Q6: =SUM(F6/D6) -> 0.33333333333333331
A7: Filipski,R.J. | B7: 1 | C7: 3 | D7: 3 | E7: 0 | F7: 1 | G7: 1 | H7: 0 | I7: 0 | J7: 0 | K7: 0 | L7: 0 | M7: 0 | N7: 0 | O7: =SUM(G7*1+H7*2+I7*3+J7*4)/D7 -> 0.33333333333333331 | P7: =SUM(F7+L7)/(D7+L7+N7) -> 0.33333333333333331 | Q7: =SUM(F7/D7) -> 0.33333333333333331
A8: Follo,Shaun | B8: 1 | C8: 3 | D8: 3 | E8: 0 | F8: 1 | G8: 1 | H8: 0 | I8: 0 | J8: 0 | K8: 0 | L8: 0 | M8: 0 | N8: 0 | O8: =SUM(G8*1+H8*2+I8*3+J8*4)/D8 -> 0.33333333333333331 | P8: =SUM(F8+L8)/(D8+L8+N8) -> 0.33333333333333331 | Q8: =SUM(F8/D8) -> 0.33333333333333331
A9: Miller,Scott | B9: 1 | C9: 3 | D9: 3 | E9: 1 | F9: 1 | G9: 1 | H9: 0 | I9: 0 | J9: 0 | K9: 0 | L9: 0 | M9: 0 | N9: 0 | O9: =SUM(G9*1+H9*2+I9*3+J9*4)/D9 -> 0.33333333333333331 | P9: =SUM(F9+L9)/(D9+L9+N9) -> 0.33333333333333331 | Q9: =SUM(F9/D9) -> 0.33333333333333331
A10: Rupe,Bob | B10: 1 | C10: 3 | D10: 3 | E10: 1 | F10: 1 | G10: 1 | H10: 0 | I10: 0 | J10: 0 | K10: 0 | L10: 0 | M10: 0 | N10: 0 | O10: =SUM(G10*1+H10*2+I10*3+J10*4)/D10 -> 0.33333333333333331 | P10: =SUM(F10+L10)/(D10+L10+N10) -> 0.33333333333333331 | Q10: =SUM(F10/D10) -> 0.33333333333333331
A11: Casserly,Mike | B11: 1 | C11: 3 | D11: 3 | E11: 1 | F11: 0 | G11: 0 | H11: 0 | I11: 0 | J11: 0 | K11: 0 | L11: 0 | M11: 0 | N11: 0 | O11: =SUM(G11*1+H11*2+I11*3+J11*4)/D11 -> 0.000 | P11: =SUM(F11+L11)/(D11+L11+N11) -> 0.000 | Q11: =SUM(F11/D11) -> 0.000
A12: Chin,Vernon | B12: 1 | C12: 3 | D12: 3 | E12: 0 | F12: 0 | G12: 0 | H12: 0 | I12: 0 | J12: 0 | K12: 0 | L12: 0 | M12: 0 | N12: 0 | O12: =SUM(G12*1+H12*2+I12*3+J12*4)/D12 -> 0.000 | P12: =SUM(F12+L12)/(D12+L12+N12) -> 0.000 | Q12: =SUM(F12/D12) -> 0.000
A13: Kostulias,Bob | B13: 1 | C13: 2 | D13: 2 | E13: 0 | F13: 0 | G13: 0 | H13: 0 | I13: 0 | J13: 0 | K13: 0 | L13: 0 | M13: 0 | N13: 0 | O13: =SUM(G13*1+H13*2+I13*3+J13*4)/D13 -> 0.000 | P13: =SUM(F13+L13)/(D13+L13+N13) -> 0.000 | Q13: =SUM(F13/D13) -> 0.000
A14: Sandurs,Eric | B14: 1 | C14: 3 | D14: 3 | E14: 0 | F14: 0 | G14: 0 | H14: 0 | I14: 0 | J14: 0 | K14: 0 | L14: 0 | M14: 0 | N14: 0 | O14: =SUM(G14*1+H14*2+I14*3+J14*4)/D14 -> 0.000 | P14: =SUM(F14+L14)/(D14+L14+N14) -> 0.000 | Q14: =SUM(F14/D14) -> 0.000
A16: TOTALS | B16: 1 | C16: =SUM(C4:C15) -> 32 | D16: =SUM(D4:D15) -> 31 | E16: =SUM(E4:E15) -> 5 | F16: =SUM(F4:F15) -> 7 | G16: =SUM(G4:G15) -> 5 | H16: =SUM(H4:H15) -> 0 | I16: =SUM(I4:I15) -> 1 | J16: =SUM(J4:J15) -> 1 | K16: =SUM(K4:K15) -> 4 | L16: =SUM(L4:L15) -> 1 | M16: =SUM(M4:M15) -> 0 | N16: =SUM(N4:N15) -> 0 | O16: =SUM(G16*1+H16*2+I16*3+J16*4)/D16 -> 0.38709677419354838 | P16: =SUM(F16+L16)/(D16+L16+N16) -> 0.250 | Q16: =SUM(F16/D16) -> 0.22580645161290322

E1: FIELDING | F1: POSITION(S)
A2: NAME | B2: PO | C2: A | D2: E | E2: PCT. | F2: PLAYED
A6: Coen,Mike | B6: 1 | C6: 0 | D6: 0 | E6: =SUM(B6+C6)/(B6+C6+D6) -> 1.000 | F6: C
A7: Eurele,Dan | B7: 0 | C7: 1 | D7: 0 | E7: =SUM(B7+C7)/(B7+C7+D7) -> 1.000 | F7: 3B
A8: Filipski,R.J. | B8: 1 | C8: 0 | D8: 0 | E8: =SUM(B8+C8)/(B8+C8+D8) -> 1.000 | F8: OF
A9: Follo,Shaun | B9: 3 | C9: 0 | D9: 0 | E9: =SUM(B9+C9)/(B9+C9+D9) -> 1.000 | F9: OF
A10: Miller,Scott | B10: 4 | C10: 1 | D10: 1 | E10: =SUM(B10+C10)/(B10+C10+D10) -> 0.83333333333333337 | F10: 2B
A11: Rupe,Bob | B11: 3 | C11: 0 | D11: 0 | E11: =SUM(B11+C11)/(B11+C11+D11) -> 1.000 | F11: 1B
A12: Bloom,Adam | B12: 5 | C12: 1 | D12: 1 | E12: =SUM(B12+C12)/(B12+C12+D12) -> 0.8571428571428571 | F12: OF
A13: Casserly,Mike | B13: 3 | C13: 5 | D13: 1 | E13: =SUM(B13+C13)/(B13+C13+D13) -> 0.88888888888888884 | F13: SS
A14: Chin,Vernon | B14: 0 | C14: 0 | D14: 0 | E14: 0.000 | F14: DH
A15: Kostulias,Bob | B15: 0 | C15: 0 | D15: 0 | E15: 0.000 | F15: P
A16: Sandurs,Eric | B16: 0 | C16: 0 | D16: 0 | E16: 0.000 | F16: OF
A18: TOTALS | B18: =SUM(B6:B17) -> 20 | C18: =SUM(C6:C17) -> 8 | D18: =SUM(D6:D17) -> 3 | E18: =SUM(B18+C18)/(B18+C18+D18) -> 0.90322580645161288

M1: OPP.
A2: NAME | B2: G | C2: IP | D2: R | E2: H | F2: ER | G2: BB | H2: SO | I2: W | J2: L | K2: .PCT | L2: ERA | M2: B.AVG.
A4: Bob Kostulias | B4: 1 | C4: 7.00 | D4: 6 | E4: 12 | F4: 6 | G4: 0 | H4: 0 | I4: 0 | J4: 1 | K4: =SUM(I4/B4) -> 0.000 | L4: =SUM(F4/C4*7) -> 6.00 | M4: =SUM(E4/(C4*3+E4)) -> 0.36363636363636365
A6: TOTALS | B6: 1 | C6: 7.00 | D6: 6 | E6: 12 | F6: 6 | G6: 0 | H6: 0 | I6: 0 | J6: 1 | K6: =SUM(I6/B6) -> 0.000 | L6: =SUM(F6/C6*7) -> 6.00 | M6: =SUM(E6/(C6*3+E6)) -> 0.36363636363636365

B2: Click here for 2005 Regular Season Stats