A1: Stats > 2005 > Regular Season | B1: Printer-Friendly

O1: SLUG. | P1: ON BASE | Q1: BATTING
A2: NAME | B2: G | C2: APP | D2: AB | E2: R | F2: H | G2: 1B | H2: 2B | I2: 3B | J2: HR | K2: RBI | L2: BB | M2: K | N2: SAC | O2: PCT. | P2: PCT. | Q2: AVG.
A4: Euerle,Dan | B4: 10 | C4: 27 | D4: 24 | E4: 12 | F4: 15 | G4: 10 | H4: 1 | I4: 2 | J4: 2 | K4: 8 | L4: 3 | M4: 0 | N4: 0 | O4: =SUM(G4*1+H4*2+I4*3+J4*4)/D4 -> 1.0833333333333333 | P4: =SUM(F4+L4)/(D4+L4+N4) -> 0.66666666666666663 | Q4: =SUM(F4/D4) -> 0.625
A5: Bloom,Adam | B5: 8 | C5: 29 | D5: 21 | E5: 7 | F5: 11 | G5: 9 | H5: 1 | I5: 1 | J5: 0 | K5: 4 | L5: 7 | M5: 2 | N5: 1 | O5: =SUM(G5*1+H5*2+I5*3+J5*4)/D5 -> 0.66666666666666663 | P5: =SUM(F5+L5)/(D5+L5+N5) -> 0.62068965517241381 | Q5: =SUM(F5/D5) -> 0.52380952380952384
A6: Coen,Mike | B6: 5 | C6: 16 | D6: 14 | E6: 3 | F6: 7 | G6: 6 | H6: 0 | I6: 1 | J6: 0 | K6: 2 | L6: 1 | M6: 0 | N6: 1 | O6: =SUM(G6*1+H6*2+I6*3+J6*4)/D6 -> 0.6428571428571429 | P6: =SUM(F6+L6)/(D6+L6+N6) -> 0.500 | Q6: =SUM(F6/D6) -> 0.500
A7: Rupe,Bob | B7: 9 | C7: 30 | D7: 25 | E7: 6 | F7: 12 | G7: 11 | H7: 0 | I7: 0 | J7: 1 | K7: 6 | L7: 5 | M7: 0 | N7: 0 | O7: =SUM(G7*1+H7*2+I7*3+J7*4)/D7 -> 0.600 | P7: =SUM(F7+L7)/(D7+L7+N7) -> 0.56666666666666665 | Q7: =SUM(F7/D7) -> 0.480
A8: Rivera,Greg | B8: 4 | C8: 10 | D8: 9 | E8: 1 | F8: 4 | G8: 4 | H8: 0 | I8: 0 | J8: 0 | K8: 2 | L8: 0 | M8: 0 | N8: 1 | O8: =SUM(G8*1+H8*2+I8*3+J8*4)/D8 -> 0.44444444444444442 | P8: =SUM(F8+L8)/(D8+L8+N8) -> 0.400 | Q8: =SUM(F8/D8) -> 0.44444444444444442
A9: Chin,Vernon | B9: 10 | C9: 32 | D9: 32 | E9: 5 | F9: 14 | G9: 13 | H9: 1 | I9: 0 | J9: 0 | K9: 8 | L9: 0 | M9: 1 | N9: 0 | O9: =SUM(G9*1+H9*2+I9*3+J9*4)/D9 -> 0.46875 | P9: =SUM(F9+L9)/(D9+L9+N9) -> 0.4375 | Q9: =SUM(F9/D9) -> 0.4375
A10: Sandurs,Eric | B10: 7 | C10: 22 | D10: 21 | E10: 5 | F10: 8 | G10: 8 | H10: 0 | I10: 0 | J10: 0 | K10: 2 | L10: 1 | M10: 0 | N10: 0 | O10: =SUM(G10*1+H10*2+I10*3+J10*4)/D10 -> 0.38095238095238093 | P10: =SUM(F10+L10)/(D10+L10+N10) -> 0.40909090909090912 | Q10: =SUM(F10/D10) -> 0.38095238095238093
A11: Miller,Scott | B11: 8 | C11: 28 | D11: 24 | E11: 4 | F11: 9 | G11: 8 | H11: 1 | I11: 0 | J11: 0 | K11: 6 | L11: 3 | M11: 1 | N11: 1 | O11: =SUM(G11*1+H11*2+I11*3+J11*4)/D11 -> 0.41666666666666669 | P11: =SUM(F11+L11)/(D11+L11+N11) -> 0.42857142857142855 | Q11: =SUM(F11/D11) -> 0.375
A12: Picciano,Justin | B12: 3 | C12: 8 | D12: 8 | E12: 1 | F12: 3 | G12: 3 | H12: 0 | I12: 0 | J12: 0 | K12: 0 | L12: 0 | M12: 0 | N12: 0 | O12: =SUM(G12*1+H12*2+I12*3+J12*4)/D12 -> 0.375 | P12: =SUM(F12+L12)/(D12+L12+N12) -> 0.375 | Q12: =SUM(F12/D12) -> 0.375
A13: Filipski,R.J. | B13: 7 | C13: 20 | D13: 20 | E13: 3 | F13: 7 | G13: 6 | H13: 1 | I13: 0 | J13: 0 | K13: 2 | L13: 0 | M13: 1 | N13: 0 | O13: =SUM(G13*1+H13*2+I13*3+J13*4)/D13 -> 0.400 | P13: =SUM(F13+L13)/(D13+L13+N13) -> 0.350 | Q13: =SUM(F13/D13) -> 0.350
A14: Mills,William | B14: 2 | C14: 6 | D14: 6 | E14: 2 | F14: 2 | G14: 2 | H14: 0 | I14: 0 | J14: 0 | K14: 2 | L14: 0 | M14: 1 | N14: 0 | O14: =SUM(G14*1+H14*2+I14*3+J14*4)/D14 -> 0.33333333333333331 | P14: =SUM(F14+L14)/(D14+L14+N14) -> 0.33333333333333331 | Q14: =SUM(F14/D14) -> 0.33333333333333331
A15: Follo,Shaun | B15: 10 | C15: 34 | D15: 28 | E15: 11 | F15: 9 | G15: 9 | H15: 0 | I15: 0 | J15: 0 | K15: 4 | L15: 3 | M15: 0 | N15: 3 | O15: =SUM(G15*1+H15*2+I15*3+J15*4)/D15 -> 0.32142857142857145 | P15: =SUM(F15+L15)/(D15+L15+N15) -> 0.35294117647058826 | Q15: =SUM(F15/D15) -> 0.32142857142857145
A16: Kostulias,Bob | B16: 9 | C16: 26 | D16: 22 | E16: 8 | F16: 7 | G16: 7 | H16: 0 | I16: 0 | J16: 0 | K16: 2 | L16: 3 | M16: 1 | N16: 1 | O16: =SUM(G16*1+H16*2+I16*3+J16*4)/D16 -> 0.31818181818181818 | P16: =SUM(F16+L16)/(D16+L16+N16) -> 0.38461538461538464 | Q16: =SUM(F16/D16) -> 0.31818181818181818
A17: Stanick,Keith | B17: 10 | C17: 33 | D17: 27 | E17: 5 | F17: 8 | G17: 5 | H17: 2 | I17: 1 | J17: 0 | K17: 9 | L17: 3 | M17: 0 | N17: 3 | O17: =SUM(G17*1+H17*2+I17*3+J17*4)/D17 -> 0.44444444444444442 | P17: =SUM(F17+L17)/(D17+L17+N17) -> 0.33333333333333331 | Q17: =SUM(F17/D17) -> 0.29629629629629628
A18: Casserly,Mike | B18: 11 | C18: 32 | D18: 32 | E18: 5 | F18: 8 | G18: 4 | H18: 3 | I18: 1 | J18: 0 | K18: 8 | L18: 0 | M18: 2 | N18: 0 | O18: =SUM(G18*1+H18*2+I18*3+J18*4)/D18 -> 0.40625 | P18: =SUM(F18+L18)/(D18+L18+N18) -> 0.250 | Q18: =SUM(F18/D18) -> 0.250
A19: Schwab,Chris | B19: 10 | C19: 29 | D19: 26 | E19: 8 | F19: 6 | G19: 6 | H19: 0 | I19: 0 | J19: 0 | K19: 3 | L19: 3 | M19: 1 | N19: 0 | O19: =SUM(G19*1+H19*2+I19*3+J19*4)/D19 -> 0.23076923076923078 | P19: =SUM(F19+L19)/(D19+L19+N19) -> 0.31034482758620691 | Q19: =SUM(F19/D19) -> 0.23076923076923078
A20: Ames,Todd | B20: 1 | C20: 3 | D20: 3 | E20: 0 | F20: 0 | G20: 0 | H20: 0 | I20: 0 | J20: 0 | K20: 0 | L20: 0 | M20: 1 | N20: 0 | O20: =SUM(G20*1+H20*2+I20*3+J20*4)/D20 -> 0.000 | P20: =SUM(F20+L20)/(D20+L20+N20) -> 0.000 | Q20: =SUM(F20/D20) -> 0.000
A22: TOTALS | B22: 11 | C22: =SUM(C4:C21) -> 385 | D22: =SUM(D4:D21) -> 342 | E22: =SUM(E4:E21) -> 86 | F22: =SUM(F4:F21) -> 130 | G22: =SUM(G4:G21) -> 111 | H22: =SUM(H4:H21) -> 10 | I22: =SUM(I4:I21) -> 6 | J22: =SUM(J4:J21) -> 3 | K22: =SUM(K4:K21) -> 68 | L22: =SUM(L4:L21) -> 32 | M22: =SUM(M4:M21) -> 11 | N22: =SUM(N4:N21) -> 11 | O22: =SUM(G22*1+H22*2+I22*3+J22*4)/D22 -> 0.47076023391812866 | P22: =SUM(F22+L22)/(D22+L22+N22) -> 0.42077922077922075 | Q22: =SUM(F22/D22) -> 0.38011695906432746

E1: FIELDING | F1: POSITION(S)
A2: NAME | B2: PO | C2: A | D2: E | E2: PCT. | F2: PLAYED
A4: Chin,Vernon | B4: 6 | C4: 0 | D4: 0 | E4: =SUM(B4+C4)/(B4+C4+D4) -> 1.000 | F4: C,DH
A5: Filipski,R.J. | B5: 13 | C5: 1 | D5: 0 | E5: =SUM(B5+C5)/(B5+C5+D5) -> 1.000 | F5: OF,2B,1B,C,P
A6: Kostulias,Bob | B6: 1 | C6: 10 | D6: 0 | E6: =SUM(B6+C6)/(B6+C6+D6) -> 1.000 | F6: P
A7: Rupe,Bob | B7: 50 | C7: 0 | D7: 2 | E7: =SUM(B7+C7)/(B7+C7+D7) -> 0.96153846153846156 | F7: 1B,OF
A8: Bloom,Adam | B8: 29 | C8: 4 | D8: 1 | E8: =SUM(B8+C8)/(B8+C8+D8) -> 0.97058823529411764 | F8: OF
A9: Stanick,Keith | B9: 12 | C9: 4 | D9: 1 | E9: =SUM(B9+C9)/(B9+C9+D9) -> 0.94117647058823528 | F9: 3B,P,OF,DH
A10: Miller,Scott | B10: 14 | C10: 9 | D10: 2 | E10: =SUM(B10+C10)/(B10+C10+D10) -> 0.920 | F10: 2B,SS,C,DH,EH
A11: Sandurs,Eric | B11: 18 | C11: 0 | D11: 2 | E11: =SUM(B11+C11)/(B11+C11+D11) -> 0.900 | F11: OF
A12: Coen,Mike | B12: 11 | C12: 5 | D12: 2 | E12: =SUM(B12+C12)/(B12+C12+D12) -> 0.88888888888888884 | F12: 2B,1B
A13: Follo,Shaun | B13: 22 | C13: 0 | D13: 3 | E13: =SUM(B13+C13)/(B13+C13+D13) -> 0.880 | F13: OF
A14: Schwab,Chris | B14: 11 | C14: 5 | D14: 3 | E14: =SUM(B14+C14)/(B14+C14+D14) -> 0.84210526315789469 | F14: OF,C,DH
A15: Casserly,Mike | B15: 21 | C15: 30 | D15: 14 | E15: =SUM(B15+C15)/(B15+C15+D15) -> 0.7846153846153846 | F15: SS,OF
A16: Euerle,Dan | B16: 13 | C16: 20 | D16: 10 | E16: =SUM(B16+C16)/(B16+C16+D16) -> 0.76744186046511631 | F16: 3B
A17: Rivera,Greg | B17: 2 | C17: 0 | D17: 0 | E17: 0.000 | F17: OF
A18: Ames,Todd | B18: 0 | C18: 0 | D18: 0 | E18: 0.000 | F18: OF
A19: Mills,Willliam | B19: 0 | C19: 0 | D19: 0 | E19: 0.000 | F19: C,EH
A20: Picciano,Justin | B20: 0 | C20: 0 | D20: 0 | E20: 0.000 | F20: C,EH
A22: TOTALS | B22: =SUM(B4:B21) -> 223 | C22: =SUM(C4:C21) -> 88 | D22: =SUM(D4:D21) -> 40 | E22: =SUM(B22+C22)/(B22+C22+D22) -> 0.88603988603988604

M1: OPP.
A2: NAME | B2: G | C2: IP | D2: R | E2: H | F2: ER | G2: BB | H2: SO | I2: W | J2: L | K2: .PCT | L2: ERA | M2: B.AVG.
A4: Bob Kostulias | B4: 9 | C4: 58.33 | D4: 43 | E4: 76 | F4: 28 | G4: 9 | H4: 4 | I4: 6 | J4: 2 | K4: =SUM(I4/B4) -> 0.66666666666666663 | L4: =SUM(F4/C4*7) -> 3.3601920109720558 | M4: =SUM(E4/(C4*3+E4)) -> 0.30280090840272522
A5: Keith Stanick | B5: 3 | C5: 15.33 | D5: 19 | E5: 22 | F5: 18 | G5: 3 | H5: 3 | I5: 1 | J5: 1 | K5: 0.500 | L5: =SUM(F5/C5*7) -> 8.2191780821917799 | M5: =SUM(E5/(C5*3+E5)) -> 0.32357699661714956
A6: R.J.Filipski | B6: 1 | C6: 1.33 | D6: 6 | E6: 4 | F6: 4 | G6: 1 | H6: 0 | I6: 0 | J6: 1 | K6: =SUM(I6/B6) -> 0.000 | L6: =SUM(F6/C6*7) -> 21.052631578947366 | M6: =SUM(E6/(C6*3+E6)) -> 0.50062578222778475
A8: TOTALS | B8: 11 | C8: 74.99 | D8: 68 | E8: 102 | F8: 50 | G8: 13 | H8: 7 | I8: 7 | J8: 4 | K8: =SUM(I8/B8) -> 0.63636363636363635 | L8: =SUM(F8/C8*7) -> 4.6672889718629156 | M8: =SUM(E8/(C8*3+E8)) -> 0.31195522525002295

B2: Click here for 2005 Post-Season Stats