A1: Player | B1: 1st Place | C1: 2nd | D1: 3rd | E1: Total*
A2: Keith Stanick | B2: 8 | C2: 1 | E2: =(B2*14)+(C2*9)+(D2*8) -> 121
A3: Mike Casserly | B3: 1 | C3: 2 | D3: 3 | E3: =(B3*14)+(C3*9)+(D3*8) -> 56
A4: Bob Kostulias | B4: 1 | C4: 3 | D4: 1 | E4: =(B4*14)+(C4*9)+(D4*8) -> 49
A5: Dan Euerle | B5: 1 | C5: 1 | D5: 2 | E5: =(B5*14)+(C5*9)+(D5*8) -> 39
A6: Eric Sandurs | C6: 2 | D6: 1 | E6: =(B6*14)+(C6*9)+(D6*8) -> 26
A7: Bob Rupe | D7: 3 | E7: =(B7*14)+(C7*9)+(D7*8) -> 24
A8: Mike Coen | C8: 1 | E8: =(B8*14)+(C8*9)+(D8*8) -> 9
A9: Adam Bloom | C9: 1 | E9: =(B9*14)+(C9*9)+(D9*8) -> 9
A10: Gina Steinmann | D10: 1 | E10: =(B10*14)+(C10*9)+(D10*8) -> 8
A11: William Mills | E11: =(B11*14)+(C11*9)+(D11*8) -> 0
A12: Vernon Chin | E12: =(B12*14)+(C12*9)+(D12*8) -> 0
A13: Pat Casserly | E13: =(B13*14)+(C13*9)+(D13*8) -> 0
A14: Greg Rivera | E14: =(B14*14)+(C14*9)+(D14*8) -> 0
A15: Chris Paper | E15: =(B15*14)+(C15*9)+(D15*8) -> 0
A17: *Total points are based on a 14-9-8 scale.

A1: Player | B1: 1st Place | C1: 2nd | D1: 3rd | E1: Total*
A2: Bob Kostulias | B2: 8 | D2: 1 | E2: =(B2*14)+(C2*9)+(D2*8) -> 120
A3: Mike Casserly | B3: 1 | C3: 4 | D3: 2 | E3: =(B3*14)+(C3*9)+(D3*8) -> 66
A4: Pat Casserly | C4: 1 | D4: 4 | E4: =(B4*14)+(C4*9)+(D4*8) -> 41
A5: Keith Stanick | C5: 1 | D5: 3 | E5: =(B5*14)+(C5*9)+(D5*8) -> 33
A6: Dan Euerle | B6: 1 | C6: 2 | E6: =(B6*14)+(C6*9)+(D6*8) -> 32
A7: Greg Rivera | C7: 2 | D7: 1 | E7: =(B7*14)+(C7*9)+(D7*8) -> 26
A8: Bob Rupe | B8: 1 | E8: =(B8*14)+(C8*9)+(D8*8) -> 14
A9: Orlando Cruz | C9: 1 | E9: =(B9*14)+(C9*9)+(D9*8) -> 9
A10: Eric Sandurs | E10: =(B10*14)+(C10*9)+(D10*8) -> 0
A11: Adam Bloom | E11: =(B11*14)+(C11*9)+(D11*8) -> 0
A12: Gina Steinmann | E12: =(B12*14)+(C12*9)+(D12*8) -> 0
A13: William Mills | E13: =(B13*14)+(C13*9)+(D13*8) -> 0
A14: Vernon Chin | E14: =(B14*14)+(C14*9)+(D14*8) -> 0
A15: Chris Paper | E15: =(B15*14)+(C15*9)+(D15*8) -> 0
A17: *Total points are based on a 14-9-8 scale.