A1: Player | B1: 1st Place | C1: 2nd | D1: 3rd | E1: Total*
A2: Bob Rupe | B2: 9 | C2: 3 | E2: =(B2*14)+(C2*9)+(D2*8) -> 153
A3: Aaron Scheid | B3: 4 | C3: 4 | D3: 4 | E3: =(B3*14)+(C3*9)+(D3*8) -> 124
A4: Bob Kostulias | C4: 4 | D4: 1 | E4: =(B4*14)+(C4*9)+(D4*8) -> 44
A5: Pat Casserly | C5: 1 | D5: 3 | E5: =(B5*14)+(C5*9)+(D5*8) -> 33
A6: Mike Casserly | D6: 3 | E6: =(B6*14)+(C6*9)+(D6*8) -> 24
A7: Keith Stanick | D7: 1 | E7: =(B7*14)+(C7*9)+(D7*8) -> 8
A9: *Total points are based on a 14-9-8 scale.

A1: Player | B1: 1st Place | C1: 2nd | D1: 3rd | E1: Total*
A2: Aaron Scheid | B2: 10 | C2: 2 | E2: =(B2*14)+(C2*9)+(D2*8) -> 158
A3: Mike Casserly | B3: 1 | C3: 5 | D3: 2 | E3: =(B3*14)+(C3*9)+(D3*8) -> 75
A4: Keith Stanick | B4: 1 | C4: 3 | D4: 4 | E4: =(B4*14)+(C4*9)+(D4*8) -> 73
A5: Scott Miller | C5: 1 | D5: 1 | E5: =(B5*14)+(C5*9)+(D5*8) -> 17
A6: Dan Euerle | D6: 2 | E6: =(B6*14)+(C6*9)+(D6*8) -> 16
A7: Pat Casserly | D7: 1 | E7: =(B7*14)+(C7*9)+(D7*8) -> 8
A8: Vernon Chin | D8: 1 | E8: =(B8*14)+(C8*9)+(D8*8) -> 8
A10: *Total points are based on a 14-9-8 scale.