A1: Player | B1: 1st Place | C1: 2nd | D1: 3rd | E1: Total*
A2: Bob Rupe | B2: 8 | C2: 1 | D2: 1 | E2: =(B2*14)+(C2*9)+(D2*8) -> 129
A3: Pat Casserly | B3: 3 | C3: 3 | D3: 3 | E3: =(B3*14)+(C3*9)+(D3*8) -> 93
A4: Bob Kostulias | C4: 6 | D4: 2 | E4: =(B4*14)+(C4*9)+(D4*8) -> 70
A5: Scott Miller | C5: 1 | D5: 2 | E5: =(B5*14)+(C5*9)+(D5*8) -> 25
A6: Shaun Follo | D6: 2 | E6: =(B6*14)+(C6*9)+(D6*8) -> 16
A7: Larry S | D7: 1 | E7: =(B7*14)+(C7*9)+(D7*8) -> 8
A9: *Total points are based on a 14-9-8 scale.