A1: Player | B1: 1st Place | C1: 2nd | D1: 3rd | E1: Total*
A2: Dan Euerle | B2: 10 | C2: 2 | D2: 1 | E2: =(B2*14)+(C2*9)+(D2*8) -> 166
A3: Adam Bloom | B3: 2 | C3: 0 | D3: 6 | E3: =(B3*14)+(C3*9)+(D3*8) -> 76
A4: Bob Kostulias | B4: 1 | C4: 6 | D4: 1 | E4: =(B4*14)+(C4*9)+(D4*8) -> 76
A5: Bob Rupe | B5: 1 | C5: 5 | D5: 0 | E5: =(B5*14)+(C5*9)+(D5*8) -> 59
A6: Mike Casserly | C6: 2 | D6: 1 | E6: =(B6*14)+(C6*9)+(D6*8) -> 26
A7: Keith Stanick | D7: 3 | E7: =(B7*14)+(C7*9)+(D7*8) -> 24
A8: Pat Casserly | B8: 1 | C8: 0 | D8: 0 | E8: =(B8*14)+(C8*9)+(D8*8) -> 14
A9: Eric Sandurs | D9: 1 | E9: =(B9*14)+(C9*9)+(D9*8) -> 8
A10: Vernon Chin | D10: 1 | E10: =(B10*14)+(C10*9)+(D10*8) -> 8
A11: Kyle Blackmon | D11: 1 | E11: =(B11*14)+(C11*9)+(D11*8) -> 8
A13: *Total points are based on a 14-9-8 scale.